ein,ccn_count,hospital_name,hcris_charity_care_cost,hcris_uncompensated_care_cost,hcris_total_operating_expenses,hcris_fy_end_dt,svi_overall_pct,svi_socio_pct,svi_household_pct,svi_minority_pct,svi_housing_pct,sched_h_organization_name,sched_h_tax_period_end,sched_h_financial_assistance_at_cost,sched_h_total_community_benefit,sched_h_total_expenses,charity_gap,community_benefit_pct_of_expenses
366000085,2,METHODIST HOSPITAL OF CHICAGO,562463,950734,102098558,2024-06-30,80,78,39,91,83,THOREK MEMORIAL HOSPITAL,2023-06-30,313328,693584,101482306,249135,0
270847538,1,ASCENSION ST VINCENT SALEM,610576,1154577,19409298,2024-06-30,34,46,47,2,33,St Vincent Salem Hospital Inc,2023-06-30,361502,3418851,17874169,249074,0
020354549,1,CHESHIRE MEDICAL CENTER,2046013,3683427,310540817,2024-06-30,17,23,2,15,60,Cheshire Medical Center,2023-06-30,2294856,23389902,287817174,-248843,0
810243720,1,SHERIDAN MEMORIAL HOSPITAL,162795,701454,20976659,2024-06-30,16,20,23,30,21,SHERIDAN MEMORIAL HOSPITAL ASSOCIATION,2023-06-30,410690,3185053,19114895,-247895,0
392031968,1,CHI HEALTH NEBRASKA HEART,616014,913875,74130850,2024-06-30,40,28,29,54,66,NEBRASKA HEART HOSPITAL,2023-06-30,373367,1044037,68992180,242647,0
560554222,1,ST LUKES HOSPITAL,483774,2085715,45398836,2023-09-30,36,31,46,42,41,ST LUKE'S HOSPITAL INC,2023-09-30,242489,3296016,42091076,241285,0
141338467,1,NORTHERN DUTCHESS HOSPITAL,1331203,2035416,179277749,2023-09-30,45,31,16,68,77,Northern Dutchess Hospital,2023-09-30,1090011,14697797,179395760,241192,0
204474637,1,JANE TODD CRAWFORD HOSPITAL,176731,766680,32236774,2024-06-30,63,80,89,10,23,JANE TODD CRAWFORD MEMORIAL HOSP,2023-06-30,417917,-18199465,28884967,-241186,-1
370673506,1,GRAHAM HOSPITAL ASSOCIATION,1381952,2922455,130590903,2024-06-30,21,43,8,21,24,GRAHAM HOSPITAL ASSOCIATION,2023-06-30,1144382,7243776,117810031,237570,0
391140373,1,PRAIRIE RIDGE HEALTH  INC.,590937,1188260,66830133,2023-09-30,10,7,11,24,39,PRAIRIE RIDGE HEALTH INC,2023-09-30,355000,12576040,68481707,235937,0
351869951,1,ST. VINCENT HEART CENTER,1236315,1863542,130714247,2024-06-30,3,1,27,51,3,CENTRAL INDIANA HEALTH SYSTEM CARDIAC SERVICES INC,2023-06-30,1001511,4232951,66078765,234804,0
010215227,1,RUMFORD HOSPITAL,79818,1920849,47484551,2024-06-30,35,65,9,13,36,RUMFORD HOSPITAL,2023-06-30,313716,3661335,52943470,-233898,0
383835105,4,KAPIOLANI MED CTR FOR WOMEN & CHILDR,4656928,7920748,1424425179,2024-06-30,57,23,26,99,96,Hawai'i Pacific Health Group Return,2023-06-30,4889835,58780912,1521333041,-232907,0
460228038,1,MADISON REGIONAL HEALTH SYSTEM,432912,1364490,34227291,2024-06-30,9,6,13,20,35,MADISON COMMUNITY HOSPITAL,2023-06-30,203000,2882824,34307837,229912,0
410706143,1,FIRST CARE MEDICAL SERVICES,95045,356147,29911185,2024-06-30,44,20,40,43,84,FIRST CARE MEDICAL SERVICES,2023-06-30,324011,1642828,30509690,-228966,0
390810545,1,ST. JOSEPHS HOSPITAL,308266,750824,56220488,2024-03-21,11,17,7,16,27,St Joseph's Hospital of the Hospital Sisters of the Third Order of St Franc,2023-06-30,81463,8626159,48582155,226803,0
811312058,1,THE MEDICAL CENTER OF ALBANY,78414,200960,7614612,2023-09-07,65,69,79,12,60,THE MEDICAL CENTER AT CLINTON COUNTY INC,2023-03-31,303912,368227,16494027,-225498,0
463433074,1,MERCY HOSPITAL KINGFISHER,291373,795354,16485883,2024-06-30,40,32,71,62,23,MERCY HOSPITAL KINGFISHER INC,2023-06-30,513906,1392481,15096499,-222533,0
866007596,1,YUMA REGIONAL MEDICAL CENTER,4128244,16057367,715197546,2023-09-30,100,98,97,96,98,Yuma Regional Medical Center,2023-09-30,4350268,48277316,772968183,-222024,0
631058174,1,CULLMAN REGIONAL,1717128,9417082,193670148,2024-06-30,49,53,71,26,33,CULLMAN REGIONAL MEDICAL CENTER INC,2023-06-30,1936900,11141538,177312584,-219772,0
421017512,1,UPLAND HILLS HEALTH,320072,667325,84964059,2023-09-30,1,2,5,13,3,UPLAND HILLS HEALTH INC,2023-09-30,538750,6734516,84323330,-218678,0
383426063,1,CARO COMMUNITY HOSPITAL,254134,342581,18745224,2023-09-30,28,38,26,21,35,CARO COMMUNITY HOSPITAL,2023-09-30,36539,1921533,19547296,217595,0
263173902,1,MERCY HOSPITAL HEALDTON  INC.,495966,1093833,8920259,2024-06-30,78,65,97,70,47,MERCY HOSPITAL HEALDTON,2023-06-30,282365,839453,8378267,213601,0
810286525,1,STILLWATER BILLINGS CLINIC,175065,278380,6718825,2023-12-31,6,4,27,22,15,STILLWATER HOSPITAL ASSOCIATION,2023-06-30,386229,388242,13836535,-211164,0
640926753,1,MARION REGIONAL MEDICAL CENTER,1292789,2146496,23133477,2023-09-30,69,86,44,26,65,Marion Regional Medical Center Inc,2023-09-30,1082374,1082374,23302301,210415,0
710655753,1,MERCY HOSPITAL PARIS,418067,855847,12114889,2024-06-30,54,50,68,34,56,MERCY HOSPITAL PARIS,2023-06-30,208887,294833,12541074,209180,0
146019179,1,PUTNAM HOSPITAL CENTER,1182242,2453534,148921848,2023-09-30,12,12,6,61,23,Putnam Hospital Center,2023-09-30,1386670,15752119,151267027,-204428,0
470399853,1,CHI HEALTH SCHUYLER,778654,1327653,15246059,2024-06-30,36,34,49,88,17,ALEGENT HEALTH-MEMORIAL HOSPITAL,2023-06-30,574269,1102537,14597326,204385,0
060646966,1,WINDHAM COMMUNITY MEMORIAL HOSPITAL,2026919,3007499,124122454,2023-09-30,,,,,,Windham Community Memorial Hospital Inc,2023-09-30,1823694,16451819,130429245,203225,0
742851819,1,ARTESIA GENERAL HOSPITAL,141435,168455,78812403,2024-06-30,64,39,87,90,52,ARTESIA GENERAL HOSPITAL,2023-06-30,344508,14651169,73991424,-203073,0
381420304,1,MCLAREN CENTRAL MICHIGAN,1316246,2509945,163309616,2023-09-30,57,79,2,44,89,MCLAREN CENTRAL MICHIGAN,2023-09-30,1114333,11612791,166322461,201913,0
352112529,1,ASCENSION ST. VINCENT CLAY,528731,1005917,19205737,2024-06-30,17,14,45,7,29,St Vincent Clay Hospital Inc,2023-06-30,328297,4558544,20364798,200434,0
222537423,1,BAYSTATE NOBLE HOSPITAL,233190,1350657,81064227,2023-09-30,82,66,86,78,78,BAYSTATE NOBLE HOSPITAL CORPORATION,2023-09-30,432487,7916747,80972738,-199297,0
853033915,1,OWENSBORO HEALTH TWIN LAKES MEDICAL,360889,1967037,53104935,2024-05-31,54,64,70,5,46,Owensboro Health Twin Lakes Regional Medical Center Inc,2023-05-31,164708,351539,50312873,196181,0
990269825,1,WAHIAWA GENERAL HOSPITAL,0,425618,29130635,2024-04-01,57,23,26,99,96,WAHIAWA GENERAL HOSPITAL,2023-06-30,195462,1755874,38330427,-195462,0
475437700,1,PIONEER MEDICAL CENTER,100310,296176,13911037,2024-06-30,2,7,11,25,3,PIONEER MEDICAL CENTER,2023-06-30,295192,301675,12403524,-194882,0
042769210,1,SOUTH SHORE HOSPITAL,3821835,9226467,823354178,2023-09-30,30,14,13,65,74,SOUTH SHORE HOSPITAL INC,2023-09-30,4015214,64541826,822354818,-193379,0
710766341,1,OUACHITA COUNTY MEDICAL CENTER,249693,1008631,35335990,2023-09-30,75,68,89,84,43,OUACHITA COUNTY MEDICAL CENTER,2023-09-30,57062,404623,40440456,192631,0
481253246,1,PAWNEE VALLEY COMMUNITY HOSPITAL,77256,560271,19637213,2024-06-30,30,25,17,47,57,Pawnee Valley Community Hospital Inc,2023-06-30,266745,3153569,19837006,-189489,0
455199762,1,MERCY HOSPITAL WATONGA,425038,858623,8116650,2024-06-30,76,70,96,67,37,MERCY HOSPITAL WATONGA INC,2023-06-30,235673,785215,8797531,189365,0
410695603,1,ST. JOSEPHS AREA HEALTH SERVICES,522068,1018923,52263027,2024-06-30,28,24,29,24,53,ST JOSEPH'S AREA HEALTH SERVICES,2023-06-30,333067,3132685,50077928,189001,0
920037099,1,SOUTH PENINSULA HOSPITAL,934253,2839586,134752860,2024-06-30,47,53,20,56,53,SOUTH PENINSULA HOSPITAL INC,2023-06-30,1122945,21885660,110793354,-188692,0
410695602,1,ST. JOSEPHS MEDICAL CENTER,1015281,2913183,305173969,2024-06-30,21,29,24,12,30,ST JOSEPH'S MEDICAL CENTER,2023-06-30,1203923,14345334,263747087,-188642,0
810231786,1,FRANCES MAHON DEACONESS HOSPITAL,543982,2082671,56065290,2024-06-30,20,20,33,44,21,FRANCES MAHON DEACONESS HOSPITAL,2023-06-30,355420,2319759,36295864,188562,0
720652905,1,WOMANS HOSPITAL,6209147,8045378,429882351,2023-09-30,85,79,63,90,85,WOMAN'S HOSPITAL FOUNDATION,2023-09-30,6397594,44549654,782416209,-188447,0
540568001,1,CARILION ROCKBRIDGE COMMUNITY HOSP,559566,1528322,65562208,2023-09-30,5,8,0,51,59,Carilion Rockbridge Community Hospital,2023-09-30,747091,3027911,70231833,-187525,0
390807065,1,ASPIRUS STANLEY HOSPITAL,304220,520629,22462972,2024-06-30,11,17,7,16,27,ASPIRUS STANLEY HOSPITAL & CLINICS INC,2023-06-30,118869,2159216,20764733,185351,0
410853163,1,TYLER HEALTHCARE CENTER,247216,248047,13538030,2024-06-30,7,10,31,7,10,Avera Tyler,2023-06-30,63320,2286840,12739104,183896,0
222807681,1,JONES MEMORIAL HOSPITAL,576847,1369059,75759646,2024-06-30,45,50,14,12,82,MEMORIAL HOSPITAL OF WILLIAM F AND,2023-06-30,394633,4951734,74067556,182214,0
450231181,1,JAMESTOWN REGIONAL MEDICAL CENTER,305006,1072089,80373726,2024-06-30,44,48,22,24,67,Lutheran Charity Association,2023-06-30,487000,2422921,73982858,-181994,0
810247969,1,LOGAN HEALTH WHITEFISH,305244,1520982,63608499,2023-12-31,21,31,8,24,39,LOGAN HEALTH - WHITEFISH,2023-03-31,485613,4622298,93449642,-180369,0
275401105,1,TWIN CITY HOSPITAL,178784,1069880,26813974,2024-06-30,42,58,37,12,39,TRINITY HOSPITAL TWIN CITY,2023-06-30,0,4923281,27625269,178784,0
823844150,1,BMH-CRITTENDEN,1884393,2331244,22174320,2023-09-30,92,93,84,92,75,BAPTIST MEMORIAL HOSPITAL-CRITTENDEN,2023-09-30,2063039,3124115,22174382,-178646,0
920573933,1,CROSSROADS COMMUNITY HOSPITAL,205639,209330,41609324,2023-09-30,71,50,82,44,84,Deaconess Illinois Crossroads Inc,2023-09-30,28000,10855048,42372338,177639,0
420818642,1,MERCYONE ELKADER MEDICAL CENTER,241282,360663,13027154,2024-06-30,28,29,60,4,30,CENTRAL COMMUNITY HOSPITAL,2023-06-30,63804,146614,12325449,177478,0
231352156,1,AMERICAN ONCOLOGIC HOSPIAL,0,0,275732222,2024-06-30,95,91,84,95,92,The American Oncologic Hospital,2023-06-30,177000,57038460,295262904,-177000,0
440537826,1,COMMUNITY HOSPITAL ASSOCIATION  INC.,219683,1337357,25008921,2024-06-30,22,33,54,8,13,COMMUNITY HOSPITAL ASSOCIATION INC,2023-06-30,44038,518728,25797577,175645,0
320583236,1,MONROE HEALTH SERVICES  INC.,2216929,3805842,44589789,2023-09-30,62,75,55,71,31,Monroe Health Services Inc,2023-09-30,2042054,2042054,44589787,174875,0
640844470,1,BAPTIST MEDICAL CENTER - YAZOO,1468260,2462146,19155988,2023-09-30,100,100,84,94,100,BAPTIST MEDICAL CENTER - YAZOO INC,2023-09-30,1642474,3903497,19155987,-174214,0
240798839,1,WAYNE MEMORIAL HOSPITAL,214828,1577418,119508637,2024-06-30,40,48,20,32,51,WAYNE MEMORIAL HOSPITAL,2023-06-30,389033,8994978,117805445,-174205,0
640655993,1,OCHSNER CHOCTAW GENERAL,564249,1529905,19195559,2023-12-31,65,69,80,82,25,RUSH HOSPITAL - BUTLER INC,2022-12-31,738251,742431,18156821,-174002,0
237426289,1,HARRISBURG MEDICAL CENTER  INC.,542603,1366210,60409673,2024-03-31,66,59,74,21,75,Harrisburg Medical Center Inc,2023-03-31,714516,10550138,55977335,-171913,0
480545923,1,CLOUD COUNTY HEALTH CENTER,450370,1072454,27204090,2023-09-30,34,45,36,27,31,Cloud County Health Center Inc,2023-09-30,280000,5282355,24619785,170370,0
450231675,1,OAKES COMMUNITY HOSPITAL,265573,462579,12407408,2024-06-30,15,19,20,32,19,OAKES COMMUNITY HOSPITAL,2023-06-30,96123,265172,11716991,169450,0
541489410,1,VCU HEALTH TAPPAHANNOCK HOSPITAL,1193928,2153878,67676670,2024-06-30,83,96,60,84,43,VCU Health Tappahannock Hospital,2023-06-30,1024548,1024548,67304916,169380,0
341048666,2,CHWC-MONTPELIER,1920145,3039299,119594101,2023-09-30,18,19,46,23,16,COMMUNITY HOSPITALS & WELLNESS CENTERS,2023-09-30,2089522,8884735,122376813,-169377,0
450227752,1,GARRISON MEMORIAL HOSPITAL,188536,394533,14010364,2024-06-30,7,2,30,36,19,GARRISON MEMORIAL HOSPITAL,2023-06-30,20140,220737,12299346,168396,0
370792770,1,GREENVILLE REGIONAL HOSPITAL,252157,526972,26045427,2024-06-30,53,32,22,39,97,HSHS Holy Family Hospital,2023-06-30,85079,5354118,28009557,167078,0
222472997,1,BROCKTON HOSPITAL  INC.,3965446,9017896,317198185,2023-09-30,31,20,36,56,47,Brockton Hospital Inc,2023-09-30,4131185,52127590,317198182,-165739,0
371396010,1,BCC DBA ILLINI COMMUNITY HOSPITAL,528021,1160078,34533857,2023-09-30,28,30,81,3,16,BLESSINGCARE CORPORATION,2023-09-30,362625,1668702,34749645,165396,0
481226977,1,GREAT PLAINS OF REPUBLIC CO.  INC,247071,646802,20190263,2023-09-30,4,4,29,9,7,Great Plains of Republic Co Inc,2023-09-30,82399,1215859,20734472,164672,0
610420440,1,HARRISON MEMORIAL HOSPITAL,706309,1947921,85082352,2023-09-30,27,29,18,13,57,HARRISON MEMORIAL HOSPITAL INC,2023-09-30,542073,617073,83288502,164236,0
460360899,4,MONUMENT HEALTH LEAD-DEADWOOD HOSPIT,1160748,4265534,205217618,2024-06-30,32,32,15,32,62,Monument Health Network Inc,2023-06-30,1324557,10259583,200759854,-163809,0
884142509,1,RED BUD REGIONAL HOSPITAL,190611,202870,28163615,2023-09-30,49,31,63,39,69,Deaconess Illinois Red Bud Regional,2023-09-30,29000,4364744,29121380,161611,0
731008550,2,JEFFERSON COUNTY HOSPITAL,3770356,5342795,182015969,2024-06-30,75,72,94,57,37,Duncan Regional Hospital Inc,2023-06-30,3609081,24203532,190581862,161275,0
540544705,1,JOHNSTON MEMORIAL HOSPITAL,2330879,3309046,186436633,2024-06-30,25,31,31,6,39,Johnston Memorial Hospital Inc,2023-06-30,2171294,12499085,175985686,159585,0
390873606,1,HOWARD YOUNG MEDICAL CENTER,384365,718004,39156872,2024-06-30,4,8,7,10,10,THE HOWARD YOUNG MEDICAL CENTER INC,2023-06-30,225094,4060033,37278756,159271,0
383160564,1,ASCENSION RIVER DISTRICT HOSPITAL,264642,831653,30509147,2024-06-30,29,43,37,28,20,ASCENSION RIVER DISTRICT HOSPITAL,2023-06-30,106480,1874235,37045561,158162,0
420782518,1,CHI HEALTH MERCY CORNING,267945,494111,23613495,2024-06-30,9,13,35,8,11,ALEGENT HEALTH-MERCY HOSPITAL CORNING,2023-06-30,110034,1483640,21659636,157911,0
362167785,1,MENDOTA COMMUNITY HOSPITAL,633896,1110777,37256142,2023-09-30,39,30,51,46,46,Mendota Community Hospital,2023-09-30,477804,3314569,38066650,156092,0
810384618,1,BIG HORN HOSPITAL,188870,1171244,17745461,2024-06-30,76,89,10,97,77,BIG HORN HOSPITAL ASSOCIATION,2023-06-30,33319,1133657,19934514,155551,0
381459366,1,MUNSON HEALTHCARE CHARLEVOIX HOSPITA,0,106126,73620270,2024-06-30,15,18,25,18,24,MUNSON HEALTHCARE CHARLEVOIX,2023-06-30,154395,6856465,72864245,-154395,0
990251372,1,MOLOKAI GENERAL HOSPITAL,177198,265183,21473917,2024-06-30,49,29,40,96,60,MOLOKAI GENERAL HOSPITAL,2023-06-30,331568,334520,47625925,-154370,0
810231793,1,ST PATRICK HOSPITAL,4298608,5294126,442382351,2023-12-31,28,35,2,37,73,PROVIDENCE HEALTH & SERVICES - MONTANA,2022-12-31,4145211,21152239,481114578,153397,0
061745397,1,OCONTO HOSPITAL & MEDICAL CENTER,657660,1156515,81698821,2023-09-30,2,5,5,10,10,OCONTO HOSPITAL AND MEDICAL CENTER,2023-09-30,504277,2960393,84257972,153383,0
621138045,1,BAPTIST MEM HOSPITAL UNION CITY,1872388,2790643,49843507,2023-09-30,61,66,79,53,31,BAPTIST MEMORIAL HOSPITAL-UNION CITY,2023-09-30,1719350,11661692,49485513,153038,0
042767880,1,MELROSEWAKEFIELD HEALTHCARE  INC,463401,1914464,286456529,2023-09-30,29,12,6,69,83,MELROSEWAKEFIELD HEALTHCARE INC,2023-09-30,613594,24529552,286401935,-150193,0
411924645,1,LONG PRAIRIE MEMORIAL HOSPITAL,525629,772057,36100012,2024-06-30,59,40,78,36,73,CENTRACARE HEALTH SYSTEM - LONG PRAIRIE,2023-06-30,378474,1207509,40660224,147155,0
382602147,1,MYMICHIGAN MEDICAL CENTER SAULT,412357,2087639,138956725,2024-06-30,64,56,18,70,91,MYMICHIGAN MEDICAL CENTER SAULT,2023-06-30,266378,10461865,143218642,145979,0
440629397,1,CARROLL COUNTY HOSPITAL,173609,424158,44554580,2024-06-30,14,30,13,10,16,CARROLL COUNTY MEMORIAL HOSPITAL,2023-06-30,318380,1141195,40751770,-144771,0
810241755,1,CABINET PEAKS MEDICAL CENTER,411299,1195877,48150374,2024-03-31,56,85,49,24,25,St John's Lutheran Hospital Inc,2023-03-31,556000,2929573,42297640,-144701,0
810236460,1,MADISON VALLEY MEDICAL CENTER,0,302149,15373893,2023-09-30,10,15,3,22,36,MADISON VALLEY HOSPITAL INC,2023-09-30,143440,1575403,15924724,-143440,0
453215312,1,KINGS DAUGHTERS MED CENTER OHIO,223380,609161,25780947,2023-09-30,75,80,46,19,90,PORTSMOUTH HOSPITAL CORPORATION,2023-06-30,83058,201489,20919363,140322,0
020280367,1,ANDROSCOGGIN VALLEY HOSPITAL,566044,3832756,83743498,2023-09-30,49,54,30,9,72,ANDROSCOGGIN VALLEY HOSPITAL INC,2023-09-30,426201,2518862,87507863,139843,0
610624096,1,CUMBERLAND COUNTY HOSPITAL,93086,580021,27485495,2024-06-30,75,88,50,15,80,CUMBERLAND COUNTY HOSPITAL ASSOCIATION,2023-06-30,232330,648446,19776676,-139244,0
410713914,1,WINONA HEALTH SERVICES,285503,1554941,137590110,2023-09-30,24,22,1,28,87,Winona Health Services Inc,2023-09-30,424000,13153676,122219652,-138497,0
030183483,1,RUTLAND REGIONAL MEDICAL CENTER,2619994,4701084,339150236,2023-09-30,40,29,17,11,91,Rutland Hospital Inc,2023-09-30,2757597,57529048,338672122,-137603,0
043229679,1,BETH ISRAEL DEACONESS HOSPITAL- NEED,846748,1410069,280081798,2023-09-30,30,14,13,65,74,BETH ISRAEL DEACONESS HOSPITAL - NEEDHAM,2023-09-30,983578,8620710,140022676,-136830,0
390806404,1,VERNON MEMORIAL HOSPITAL,993607,1921372,71883551,2023-09-30,48,44,55,5,70,VERNON MEMORIAL HEALTHCARE INC,2023-09-30,858093,4543845,82056626,135514,0
920574426,1,UNION COUNTY HOSPITAL DISTRICT,185780,219597,20618474,2023-09-30,60,66,44,26,71,Deaconess Illinois Union County,2023-09-30,51000,3947164,21791254,134780,0
380350304,1,MUNSON HEALTHCARE MANISTEE HOSPITAL,0,71661,55570436,2024-06-30,36,40,27,36,44,MUNSON HEALTHCARE MANISTEE,2023-06-30,133638,7312408,61273657,-133638,0
411811073,1,ST MARYS HOSPITAL SUPERIOR,747546,2243144,83817963,2024-06-30,29,17,36,27,66,ST MARY'S HOSPITAL OF SUPERIOR,2023-06-30,614396,2834218,84139848,133150,0
710835247,1,CROSSRIDGE COMMUNITY HOSPITAL,581674,1199643,19476089,2023-09-30,92,91,95,64,78,ST BERNARDS COMMUNITY HOSPITAL,2023-09-30,449538,1454084,19124186,132136,0
390808503,1,ASPIRUS MERRILL HOSPITAL,168061,512346,26110919,2024-06-30,18,25,20,10,28,ASPIRUS MERRILL HOSPITAL & CLINICS INC,2023-06-30,299743,2108793,23542139,-131682,0
440546366,1,CAPITAL REGION MEDICAL CENTER,4331962,4632371,135883676,2023-12-31,20,12,19,52,47,CAPITAL REGION MEDICAL CENTER,2023-06-30,4463224,19175885,263388160,-131262,0
621816368,1,HAWKINS COUNTY MEMORIAL HOSPITAL,915111,1210419,14585625,2024-06-30,56,75,60,9,42,Wellmont Hawkins County Memorial,2023-06-30,784074,3144163,15058939,131037,0
460400557,1,DOUGLAS COUNTY MEMORIAL HOSPITAL,16587,433794,12662678,2024-05-31,32,29,42,12,52,DOUGLAS COUNTY MEMORIAL HOSPITAL,2023-05-31,147189,310449,12073754,-130602,0
810469886,1,DEER LODGE MEDICAL CENTER,168735,474020,24593726,2024-06-30,23,18,5,36,72,POWELL COUNTY MEMORIAL HOSPITAL ASSOC,2023-06-30,297723,827937,23369558,-128988,0
020226774,1,SPEARE MEMORIAL HOSPITAL,393814,917142,79984603,2024-06-30,26,21,8,33,70,Speare Memorial Hospital,2023-06-30,265376,7040611,77186933,128438,0
742323822,1,YOAKUM COMMUNITY HOSPITAL,1599833,2333652,24908081,2024-06-30,84,79,54,85,91,Yoakum Community Hospital,2023-06-30,1473000,1473000,27781282,126833,0
815056290,1,SHARON HOSPITAL,941338,1591309,73698168,2023-09-30,,,,,,Vassar Health Connecticut Inc,2023-09-30,1067352,11030347,73683904,-126014,0
452438973,1,CCH - SAUK CENTRE,252640,400559,41874258,2024-06-30,46,27,30,47,85,CENTRACARE HEALTH SYSTEM - SAUK CENTRE,2023-06-30,127858,1266164,39986521,124782,0
941502014,1,MEE MEMORIAL HOSPITAL,257925,1225568,68282391,2023-09-30,87,83,58,96,87,SOUTHERN MONTEREY COUNTY MEMORIAL,2023-09-30,380591,15161596,68303517,-122666,0
930425580,1,GOOD SHEPHERD MEDICAL CENTER,4388608,6502925,190985339,2024-06-30,93,67,96,74,99,GOOD SHEPHERD HEALTH CARE SYSTEM,2023-06-30,4268935,45016768,168697863,119673,0
383236977,1,ASPIRUS IRON RIVER HOPSITAL & CLINIC,327037,865884,39181852,2024-06-30,32,35,43,15,42,ASPIRUS IRON RIVER HOSPITAL & CLINICS,2023-06-30,209067,2756424,41025587,117970,0
391568865,1,MOSH,202204,456534,55318695,2023-12-31,83,69,76,87,84,WHEATON FRANCISCAN HEALTHCARE - SOUTHEAST WISCONSIN INC,2023-06-30,84302,1548681,34463400,117902,0
273311774,1,ST. LUKES MCCALL,856324,2045118,51070144,2023-09-30,14,48,4,0,12,St Luke's McCall Ltd,2023-09-30,740370,2350438,55160604,115954,0
381443395,1,ASCENSION ST. JOSEPH HOSPITAL,458522,1223666,54419107,2024-06-30,44,67,40,20,24,ASCENSION ST JOSEPH HOSPITAL,2023-06-30,574220,3051420,56611949,-115698,0
370702309,1,HARDIN COUNTY GENERAL HOSPITAL,300789,642344,15921035,2024-03-31,24,17,53,1,46,HARDIN COUNTY GENERAL HOSPITAL,2023-03-31,415813,1793927,14893976,-115024,0
452896080,1,BAPTIST MEDICAL CENTER - LEAKE  INC.,991531,1924457,19111181,2023-09-30,96,87,97,88,86,BAPTIST MEDICAL CENTER - LEAKE INC,2023-09-30,878730,3234237,19110913,112801,0
391834639,2,ORTHOPAEDIC HOSPITAL OF WISCONSIN,128122,310224,82502076,2023-12-31,42,36,41,63,46,COLUMBIA ST MARY'S INC,2023-06-30,15528,1412957,198377369,112594,0
582257925,1,EVANS MEMORIAL HOSPITAL,261283,720539,19731893,2023-09-30,98,96,98,82,83,EVANS MEMORIAL HOSPITAL INC,2023-09-30,148886,1392343,19707065,112397,0
350876389,1,ASCENSION ST. VINCENT MERCY,563416,1003485,25396188,2024-06-30,60,56,66,46,57,ST VINCENT MADISON COUNTY HEALTH SYSTEM INC,2023-06-30,452718,5115491,24039029,110698,0
208756459,1,MACKINAC STRAITS HEALTH SYSTEM  INC,382752,1563253,67274920,2024-03-31,62,60,45,64,65,MACKINAC STRAITS HEALTH SYSTEM INC,2023-03-31,273089,2304321,64654395,109663,0
470379039,1,YORK GENERAL HOSPITAL INC,185009,951665,59710351,2023-09-30,14,4,15,30,57,YORK GENERAL HEALTH CARE SERVICES,2023-09-30,294606,5435772,59333818,-109597,0
730662663,1,ST JOHN SAPULPA,900633,1749725,26066801,2024-06-30,52,41,54,62,57,St John Sapulpa Inc,2023-06-30,1009620,3627630,26363300,-108987,0
843196350,1,UOFL HEALTH-SHELBYVILLE,867046,1670548,42689493,2024-06-30,29,26,38,54,30,U OF L HEALTH - SHELBYVILLE INC,2023-06-30,975957,5803132,37979925,-108911,0
810530457,1,LOGAN HEALTH  CUTBANK,156402,393171,9011616,2023-12-31,98,96,84,96,95,LOGAN HEALTH - CUT BANK,2023-03-31,262481,2792122,11794029,-106079,0
770599553,1,DICKENSON COMMUNITY HOSPITAL,147006,306471,11253718,2023-09-30,46,57,31,0,64,Dickenson Community Hospital Inc,2023-06-30,41977,4364380,10600306,105029,0
330528802,1,CHILDRENS HOSPITAL AT MISSION,0,0,0,2024-06-30,57,54,18,93,66,CHILDREN'S HOSPITAL AT MISSION,2023-06-30,103365,14739157,105380405,-103365,inf
481020227,1,COMMUNITY HEALTHCARE SYSTEM,135863,834921,39471132,2024-03-31,5,2,10,33,29,Community HealthCare System Inc,2023-03-31,32694,3884715,37254287,103169,0
410758434,1,LAKEWOOD HEALTH CENTER,196942,456340,21559343,2024-06-30,4,9,3,23,16,LAKEWOOD HEALTH CENTER,2023-06-30,95485,1421414,19379929,101457,0
201890414,1,FAYETTE COUNTY HOSPITAL,224876,1873450,44300247,2024-06-30,56,44,62,31,78,HEARTLAND HEALTH SYSTEM INC,2023-06-30,325387,4848516,39898941,-100511,0
813747248,1,SAINT FRANCIS HOSPITAL VINITA,1011330,1642664,23264152,2024-06-30,93,83,94,78,91,Saint Francis Hospital Vinita Inc,2023-06-30,911505,2467886,24791269,99825,0
386005550,1,HILLSDALE HOSPITAL,457233,2040804,86827548,2024-06-30,48,47,32,12,78,HILLSDALE COMMUNITY HEALTH CENTER,2023-06-30,358371,9179296,84425894,98862,0
381443361,1,ASPIRUS KEWEENAW HOSPITAL,401057,1055022,74717117,2024-06-30,42,53,2,24,88,ASPIRUS KEWEENAW HOSPITAL,2023-06-30,304290,5947824,67471667,96767,0
580973772,1,DONALSONVILLE HOSPITAL,1477575,2891907,33422703,2024-06-30,88,90,86,76,69,DONALSONVILLE HOSPITAL INC,2023-06-30,1380826,1689767,39424783,96749,0
820844453,1,UPMC LITITZ,1310175,2093662,98614218,2024-06-30,54,46,35,52,75,UPMC Lititz,2023-06-30,1405926,9870574,133457876,-95751,0
930591528,1,LEGACY MOUNT HOOD MEDICAL CENTER,5672207,7950112,215473618,2024-03-31,59,50,10,70,93,LEGACY MOUNT HOOD MEDICAL CENTER,2023-03-31,5578089,29359325,227262005,94118,0
851433123,1,CONCORD HOSPITAL - FRANKLIN,312299,1566639,25749457,2023-09-30,21,16,8,24,67,Concord Hospital - Franklin,2023-09-30,405354,3090837,28622927,-93055,0
390910727,1,WAUKESHA MEMORIAL HOSPITAL,869925,4198369,537970302,2023-09-30,2,2,5,39,9,PROHEALTH WAUKESHA MEMORIAL,2023-09-30,777316,50030182,551613171,92609,0
941294954,1,VALLEY CHILDRENS HOSPITAL,0,0,761809083,2023-09-30,96,94,88,97,88,VALLEY CHILDREN'S HOSPITAL,2023-09-30,92423,66032561,775757099,-92423,0
550477361,1,BOONE MEMORIAL HOSPITAL,25131,573934,83609768,2024-06-30,40,58,56,0,26,BOONE MEMORIAL HOSPITAL INC,2023-06-30,117206,1416076,70345825,-92075,0
731547175,1,LAWRENCE MEMORIAL HOSPITAL,401815,1254170,20039152,2024-06-30,70,76,76,16,64,LAWRENCE MEMORIAL HEALTH FOUNDATION INC,2023-06-30,310000,1028931,19096200,91815,0
640819193,1,WEBSTER HEALTH SERVICES,985286,1609008,23874109,2023-09-30,61,79,69,55,21,Webster Health Services Inc,2023-09-30,894386,894386,24021022,90900,0
390890676,1,ST CROIX REGIONAL MEDICAL CENTER,112625,249125,63127502,2023-12-31,7,16,10,9,13,ST CROIX REGIONAL MEDICAL CENTER,2023-06-30,202794,21024509,148791084,-90169,0
341041385,1,SALEM COMMUNITY HOSPITAL,369099,1339487,127278295,2024-06-30,42,42,36,17,61,SALEM COMMUNITY HOSPITAL,2023-06-30,280917,4134281,117279252,88182,0
562112733,1,THE OUTER BANKS HOSPITAL INC,1957857,6417319,73031628,2023-09-30,21,38,14,41,14,The Outer Banks Hospital Inc,2023-09-30,1870052,2948396,116906754,87805,0
460345312,1,HURON REGIONAL MEDICAL CENTER,48348,1750293,54048225,2024-06-30,73,40,80,63,93,HURON REGIONAL MEDICAL CENTER INC,2023-06-30,135819,3843254,51960020,-87471,0
810269223,1,MCCONE COUNTY HEALTH CENTER,87876,214300,5423770,2024-06-30,1,1,7,27,6,MCCONE COUNTY HEALTH CENTER INC,2023-06-30,752,335481,5132413,87124,0
020222242,1,WEEKS MEDICAL CENTER,277008,1446316,83318048,2023-09-30,49,54,30,9,72,WEEKS MEDICAL CENTER,2023-09-30,190787,17772469,88104263,86221,0
061705652,1,CASEY COUNTY HOSPITAL,315304,585400,29946135,2024-06-30,84,94,61,9,89,CASEY COUNTY HOSPITAL DISTRICT,2023-06-30,401156,401156,27693173,-85852,0
421470935,1,MERCYONE - NEWTON MEDICAL CENTER,226968,848306,40642485,2024-06-30,21,17,44,20,31,MERCY MEDICAL CENTER - NEWTON,2023-06-30,141631,2057662,41812801,85337,0
540794913,1,SMYTH COUNTY COMMUNITY HOSPITAL,762180,1169074,50192048,2024-06-30,68,55,89,12,77,Smyth County Community Hospital,2023-06-30,677016,1696928,47496954,85164,0
250965579,1,TITUSVILLE AREA HOSPITAL,708817,1627601,55886370,2024-06-30,58,54,63,12,76,TITUSVILLE AREA HOSPITAL,2023-06-30,623809,5015049,52992803,85008,0
030177161,1,GRACE COTTAGE HOSPITAL,131032,739985,33638016,2023-09-30,32,32,32,23,49,Carlos G Otis Health Care Center,2023-09-30,215350,3734780,34616276,-84318,0
