ein,ccn_count,hospital_name,hcris_charity_care_cost,hcris_uncompensated_care_cost,hcris_total_operating_expenses,sched_h_organization_name,sched_h_tax_period_end,sched_h_financial_assistance_at_cost,sched_h_total_community_benefit,sched_h_total_expenses,charity_gap,community_benefit_pct_of_expenses
743107055,1,ASCENSION ST. VINCENT CARMEL,1909101,3079753,183585865,St Vincent Carmel Hospital Inc,2023-06-30,1279260,16406631,165415886,629841,0
410730602,1,LAKE REGION HEALTHCARE,1143882,2284327,161948870,LAKE REGION HEALTHCARE CORPORATION,2023-09-30,515000,8650334,161649037,628882,0
850106941,1,ST. VINCENT HOSPITAL,10797383,12302678,580509930,St Vincent Hospital,2023-06-30,10169466,26520265,553956987,627917,0
271965272,1,VIA CHRISTI HOSP. WICHITA ST. TERESA,2386072,3018592,51271125,ASCENSION VIA CHRISTI HOSPITAL ST TERESA INC,2023-06-30,1759425,1831928,45418176,626647,0
710644637,1,HOWARD MEMORIAL HOSPITAL,897982,1347909,31169206,HOWARD MEMORIAL HOSPITAL,2023-09-30,273039,329182,31246292,624943,0
050258954,1,RHODE ISLAND HOSPITAL,20946380,33526955,1896029560,Rhode Island Hospital,2023-09-30,20326208,215613813,1953672170,620172,0
362183812,1,OAK PARK HOSPITAL,3954105,5486225,197653080,Rush Oak Park Hospital Inc,2023-06-30,3340283,23065471,188436826,613822,0
363332852,1,MACNEAL HOSPITAL,8486831,9286498,284027607,GOTTLIEB COMMUNITY HEALTH SERVICES,2023-06-30,7876056,31130298,257408502,610775,0
010217211,1,INLAND HOSPITAL,659526,1988632,84770490,INLAND HOSPITAL,2023-09-30,49262,7520001,84742959,610264,0
390992883,1,MILE BLUFF MEDICAL CENTER  INC.,24734,352272,121801915,Mile Bluff Medical Center Inc,2023-09-30,633000,13411234,117313908,-608266,0
851443782,1,CONCORD HOSPITAL - LACONIA,472376,2193674,144243614,Concord Hospital - Laconia,2023-09-30,1078033,20632440,150570506,-605657,0
042768252,1,STURDY MEMORIAL HOSPITAL,1625250,4033338,256606085,STURDY MEMORIAL HOSPITAL INC,2023-09-30,1021709,22982108,285733561,603541,0
851634852,1,VERDUGO HILLS HOSPITAL,1669680,2150352,233699638,USC VERDUGO HILLS HOSPITAL,2023-06-30,1067361,19436983,191423873,602319,0
823745228,1,UNC ROCKINGHAM HOSPITAL,2156137,5818450,66368898,UNC Rockingham Health Care Inc,2023-06-30,2752747,3050363,79762409,-596610,0
951643347,1,REDLANDS COMMUNITY HOSPITAL,4178036,4969037,215966916,REDLANDS COMMUNITY HOSPITAL,2023-09-30,3589122,23720177,402070342,588914,0
344428205,1,THE BELLEVUE HOSPITAL,578882,1627436,58761347,THE BELLEVUE HOSPITAL,2022-12-31,1159924,2543929,58272285,-581042,0
042133860,1,FAIRVIEW HOSPITAL,73029,1686348,82454469,FAIRVIEW HOSPITAL,2023-09-30,651342,2155491,82451373,-578313,0
010211797,1,MOUNT DESERT ISLAND HOSPITAL,779866,3670825,85422959,Mount Desert Island Hospital,2023-04-30,205152,5466982,88439225,574714,0
440607149,1,MERCY ST FRANCIS HOSPITAL,972319,1663397,17708655,Mercy St Francis Hospital,2023-06-30,405097,1442864,17951330,567222,0
592951990,1,ADVENTHEALTH PALM COAST,7456875,9001206,264487195,MEMORIAL HOSPITAL FLAGLER INC,2022-12-31,6890622,14233938,263405374,566253,0
381369611,1,MCLAREN PORT HURON,2450876,4876711,230916327,MCLAREN PORT HURON,2023-09-30,1887710,6300706,245775721,563166,0
452696517,3,MARY BRECKINRIDGE HOSPITAL,566227,1602123,80472273,ARH MARY BRECKINRIDGE HEALTH SERVICE,2023-06-30,1127659,1367962,88885232,-561432,0
481040759,1,NEWTON MEDICAL CENTER,1490051,2600133,104952435,NEWTON HEALTHCARE CORPORATION,2023-06-30,935891,5070284,101052051,554160,0
362167884,1,ST. MARGARETS HEALTH - SPRING VALLEY,0,0,77512542,St Margaret's Health-Spring Valley,2023-09-30,544000,18800349,77297391,-544000,0
390884478,1,BELLIN MEMORIAL HOSPITAL,3493956,5644804,594417528,BELLIN MEMORIAL HOSPITAL INC,2023-09-30,4035734,62497307,718722309,-541778,0
020222156,1,MEMORIAL HOSPITAL,1200292,3637645,105792188,The Memorial Hospital at North Conway,2023-09-30,664038,7246544,105333975,536254,0
440655986,1,JOHN FITZGIBBON MEMORIAL HOSPITAL,592404,2822793,68915247,JOHN FITZGIBBON MEMORIAL HOSPITAL,2023-04-30,57756,4914049,67392993,534648,0
314413259,1,SELBY GENERAL HOSPITAL,1257655,2546416,67557451,SELBY GENERAL HOSPITAL,2023-09-30,1787685,4912708,71837907,-530030,0
611272692,1,ST FRANCIS HOSPITAL,561870,1086948,40291429,Charleston Hospital Inc,2023-09-30,32718,2028094,41647787,529152,0
810233499,1,SIDNEY HEALTH CENTER,1076377,2846494,106480844,SIDNEY HEALTH CENTER,2023-06-30,547778,14098193,102102704,528599,0
350992717,1,ASCENSION ST. VINCENT KOKOMO,1969857,3191064,156171267,St Joseph Hospital & Health Center Inc,2023-06-30,1452030,15348415,159290910,517827,0
381362830,1,MUNSON MEDICAL CENTER,2453752,6109978,812471654,MUNSON MEDICAL CENTER,2023-06-30,1937004,62801253,766593955,516748,0
030185556,1,NORTH COUNTRY HOSPITAL & HEALTH CTR,976417,1581000,108024468,NORTH COUNTRY HOSPITAL & HEALTH CENTER INC,2023-09-30,462278,30613929,108080771,514139,0
042104338,1,ANNA JAQUES HOSPITAL,490339,2793200,161741245,ANNA JAQUES HOSPITAL INC,2023-09-30,1004100,17261886,163230546,-513761,0
231534300,1,HOLY REDEEMER HOSPITAL,1804535,3425771,262053661,HOLY REDEEMER HEALTH SYSTEM,2023-06-30,1293623,15071825,383817778,510912,0
470533373,1,COMMUNITY HOSPITAL ASSOCOCIATION,772632,1665609,65948054,COMMUNITY HOSPITAL ASSOCIATION OF MCCOOK,2023-06-30,1279549,2659801,60120323,-506917,0
821162805,1,ST. LUKES NAMPA MEDICAL CENTER,4311860,9241339,236471647,St Luke's Nampa Medical Center Ltd,2023-09-30,3805788,17642478,236025490,506072,0
231360854,1,WAYNESBORO HOSPITAL,1017456,2129006,78780883,WAYNESBORO HOSPITAL,2023-06-30,515953,6886261,76524252,501503,0
930430029,1,TUALITY HEALTHCARE,6387388,6680015,322935087,TUALITY HEALTHCARE,2023-06-30,5887654,28655203,307109192,499734,0
141338586,1,VASSAR BROTHERS MEDICAL CENTER,6912617,10204200,799433847,Vassar Brothers Medical Center,2023-09-30,7409416,92328415,804194259,-496799,0
390868982,1,ASPIRUS RIVERVIEW HOSPITAL & CLINICS,1213100,1992690,152734715,ASPIRUS RIVERVIEW HOSPITAL,2023-06-30,717707,12641748,142925260,495393,0
410758512,1,MADELIA HEALTH,0,572253,23121748,MADELIA HEALTH,2023-05-31,495000,1619799,20584097,-495000,0
351841606,1,ASCENSION ST. VINCENT JENNINGS,995424,1515458,19220104,St Vincent Jennings Hospital Inc,2023-06-30,508618,592154,18328408,486806,0
520679694,1,CHESTER RIVER HOSPITAL CENTER,0,0,42578100,Chester River Hospital Center Inc,2023-06-30,477977,2056402,43777985,-477977,0
390816818,1,ASCENSION NE WISCONSIN-ST. ELIZABETH,3363071,7050658,363565825,ASCENSION NE WISCONSIN INC,2023-06-30,2893697,16440369,360933598,469374,0
311131099,1,OHIO COUNTY HOSPITAL,85118,1905764,72479417,OHIO COUNTY HOSPITAL CORPORATION,2023-09-30,550572,4136732,77243418,-465454,0
350868130,1,MARION GENERAL HOSPITAL,3975133,6715296,217413757,MARION GENERAL HOSPITAL INC,2023-06-30,3510295,32455650,216017334,464838,0
010130427,1,BRIDGTON HOSPITAL,109156,2183124,48863664,BRIDGTON HOSPITAL,2023-06-30,573810,2712856,54554893,-464654,0
420733472,1,ST. ANTHONY REGIONAL HOSPITAL,962626,1617777,75679574,St Anthony Regional Hospital,2023-06-30,1427000,10336632,100659213,-464374,0
390808480,1,ST. NICHOLAS HOSPITAL,494987,875697,123986597,St Nicholas Hospital of the Hospital Sisters of the Third Order of St Franc,2023-06-30,31526,11885149,123028970,463461,0
237169043,1,CENTRAL MONTANA MEDICAL CENTER,1203024,1350868,51157044,Central Montana Medical Facilities Inc,2023-06-30,740000,6873827,48009450,463024,0
201835779,1,OCHSNER LAIRD HOSPITAL,635815,1622108,35288776,LAIRD HOSPITAL INC,2022-12-31,1098319,1179351,34307299,-462504,0
201649466,1,KARMANOS CANCER HOSPITAL,1278387,2770783,419162172,BARBARA ANN KARMANOS CANCER HOSPITAL,2023-09-30,1740842,27526736,434686052,-462455,0
411878730,2,ESSENTIA HEALTH VIRGINIA,1404948,3764631,751903650,SMDC MEDICAL CENTER,2023-06-30,1865176,49133533,711850704,-460228,0
261175213,1,INNOVIS HEALTH,3505525,9217002,593265300,INNOVIS HEALTH LLC,2023-06-30,3047644,22842222,589895217,457881,0
271790052,1,SAINT ALPHONSUS MEDICAL CENTER BAKER,652059,868765,38707500,SAINT ALPHONSUS MEDICAL CENTER -,2023-06-30,197019,2894396,38584583,455040,0
821682066,1,FISHERMENS HOSPITAL,1029733,4104638,36495976,Fishermens Health Inc,2023-09-30,1483406,3997096,52275783,-453673,0
593149293,1,ADVENTHEALTH FISH MEMORIAL,9992386,12351759,250679806,SOUTHWEST VOLUSIA HEALTHCARE CORPORATION,2022-12-31,9539043,29390912,235506078,453343,0
392014409,1,FROEDTERT HLTH NEIGHORHOOD HOSP LLC,546744,1373513,29741946,FROEDTERT HEALTH INC,2023-06-30,95842,3039074,990329085,450902,0
540553805,1,CARILION NEW RIVER VALLEY MED CENTER,1963887,5227348,257931754,Carilion New River Valley Medical Center,2023-09-30,1513054,2699323,278301998,450833,0
731192765,1,LAKESIDE WOMENS HOSPITAL,370609,586258,26797862,INTEGRIS AMBULATORY CARE CORP,2023-06-30,819742,11458175,287905583,-449133,0
042103604,1,BIDMC-MILTON HOSPITAL  INC,475941,3300025,154047453,BETH ISRAEL DEACONESS HOSPITAL - MILTON,2023-09-30,920666,15198581,154047453,-444725,0
390808443,1,ASPIRUS STEVENS POINT HOSPITAL,1363428,2343971,149329834,ASPIRUS STEVENS POINT HOSPITAL & CLINICS,2023-06-30,919403,13671664,144176696,444025,0
592425149,1,JAY HOSPITAL,1059992,1599942,16798387,Jay Hospital Inc,2023-09-30,620717,1206867,18377155,439275,0
592447554,1,BETHESDA HOSPITAL,11869167,16135716,463723743,Bethesda Hospital Inc,2023-09-30,12304681,64652352,525634579,-435514,0
390964813,1,ASPIRUS MEDFORD HOSPITAL AND CLINICS,1164141,1943277,84901108,ASPIRUS MEDFORD HOSPITAL & CLINICS INC,2023-06-30,729993,3634045,93482497,434148,0
752771569,1,CHRISTUS MFH WINNSBORO,1612024,2021018,21501741,Mother Frances Hospital - Winnsboro,2023-06-30,2044790,2096124,21439412,-432766,0
271757642,1,OCHSNER STENNIS HOSPITAL,293858,887349,22950500,KEMPER CAH INC,2022-12-31,718447,846161,21772716,-424589,0
030179423,1,COPLEY HOSPITAL  INC.,206480,2083200,99802638,Copley Hospital Inc,2023-09-30,628117,9002962,99802640,-421637,0
610492356,1,EPHRAIM MCDOWELL REG MED CTR,2117794,4567064,251944900,EPHRAIM MCDOWELL REGIONAL MEDICAL CENTER,2023-09-30,2538979,2538979,254289997,-421185,0
222563241,1,SOUTHWESTERN VERMONT MEDICAL CENTER,1282761,3003643,204148886,SOUTHWESTERN VERMONT MEDICAL CENTER,2023-09-30,861934,30792777,204195127,420827,0
851538878,1,SINGING RIVER GULFPORT,1211767,7572276,112572376,SINGING RIVER GULFPORT,2023-09-30,1632207,2726642,112547061,-420440,0
350784551,1,ASCENSION ST. VINCENT WILLIAMSPORT,750317,1243539,24948871,ST VINCENT WILLIAMSPORT HOSPITAL INC,2023-06-30,334027,3949408,24182330,416290,0
522218584,1,GEORGETOWN UNIVERSITY HOSPITAL,6630891,9230724,1184811751,THE MEDSTAR-GEORGETOWN MEDICAL,2023-06-30,6215310,67159891,1348071151,415581,0
951690977,1,CHILDRENS HOSPITAL LOS ANGELES,0,0,1825548834,CHILDREN'S HOSPITAL LOS ANGELES,2023-06-30,414302,183778115,1652929444,-414302,0
236000204,1,WILLS EYE HOSPITAL,246087,502900,55871244,CITY OF PHILADELPHIA TRUSTEE,2023-06-30,660000,12378824,53983793,-413913,0
010284446,1,REDINGTON-FAIRVIEW GENERAL HOSPITAL,1207157,8785585,139549458,REDINGTON-FAIRVIEW GENERAL HOSPITAL,2023-06-30,1620143,17183638,151980165,-412986,0
421418847,2,GENESIS MEDICAL CENTER - DAVENPORT,3148498,7331804,456369585,Genesis Health System,2023-06-30,3558904,34554502,626348697,-410406,0
580655369,1,TAYLOR REGIONAL HOSPITAL,494880,1171446,31912005,TAYLOR REGIONAL HOSPITAL INC,2023-03-31,87830,4537587,33300331,407050,0
810378200,1,LIVINGSTON HEALTHCARE,841182,2874311,90540981,Livingston Healthcare,2023-06-30,436000,6374600,77803844,405182,0
020223332,1,HUGGINS HOSPITAL,645424,2297133,97875999,Huggins Hospital,2023-09-30,242005,5415202,98148099,403419,0
203700131,1,ST. JOHN OWASSO,1658218,2420723,41902377,Owasso Medical Facility Inc,2023-06-30,1256798,3044446,38028059,401420,0
475676956,1,JOHNSON MEMORIAL HOSPITAL  INC.,571029,1524340,66663564,JOHNSON MEMORIAL HOSPITAL INC,2023-09-30,169672,7546467,67421318,401357,0
990260423,1,QUEENS NORTH HAWAII COMMUNITY HOSPI,414543,1395893,101431915,QUEEN'S NORTH HAWAII COMMUNITY HOSPITAL,2023-06-30,17172,7578905,94897769,397371,0
520646893,1,MEDSTAR MONTGOMERY MEDICAL CENTER,4943556,7013526,203366223,MONTGOMERY GENERAL HOSPITAL INC,2023-06-30,5339036,13513936,198219487,-395480,0
421178403,1,MERCYONE OELWEIN MEDICAL CENTER,510139,739567,15053872,MERCY HOSPITAL OF FRANCISCAN SISTERS,2023-06-30,117518,218936,15128106,392621,0
370663568,1,ST. JOSEPHS HOSPITAL-HIGHLAND IL,532494,942906,42704440,St Joseph's Hospital of the Hospital Sisters of the Third Order of St Franc,2023-06-30,141151,936443,44427510,391343,0
800618988,1,LAWRENCE COUNTY MEMORIAL HOSPITAL,624299,1454554,31308860,LAWRENCE COUNTY MEMORIAL HOSPITAL,2023-06-30,1015508,2400807,26059505,-391209,0
222547186,1,CENTRAL VERMONT HOSPITAL,1884413,5113733,290884614,CENTRAL VERMONT MEDICAL CENTER INC,2023-09-30,1495928,41786036,290980110,388485,0
841465990,1,ARKANSAS VALLEY REGL MED CTR,633237,1361661,40945723,ARKANSAS VALLEY REGIONAL MEDICAL,2023-03-31,245518,289673,38805522,387719,0
560529974,1,CHARLES A. CANNON MEMORIAL HOSPITAL,491693,1778447,47449950,CHARLES A CANNON JR MEMORIAL,2023-06-30,105125,805007,19682646,386568,0
232899911,1,WELLSPAN SURGERY AND REHAB HOSPITAL,673946,929160,112345031,WELLSPAN SURGERY & REHABILITATION,2023-06-30,289122,9677518,117582525,384824,0
460226738,1,AVERA ST. BENEDICT HEALTH CENTER,488201,488776,24905763,St Benedict Health Center,2023-06-30,105506,698998,23596492,382695,0
371208459,1,ST. JOSEPHS HOSPITAL,621174,1150372,56619263,St Joseph's Hospital - Hospital Sisters - Third Order of St Francis,2023-06-30,244228,2936369,56909327,376946,0
460225414,1,ST. MICHAELS HOSPITAL  INC.,396517,397339,13307527,ST MICHAEL'S HOSPITAL INC,2023-06-30,20000,1488954,12626419,376517,0
352103153,1,ASCENSION ST. VINCENT RANDOLPH,1027528,1531619,24527701,St Vincent Randolph Hospital Inc,2023-06-30,651676,755557,24596383,375852,0
270440772,1,TUFTS MEDICAL CENTER,2649141,5504869,1273509000,TUFTS MEDICAL CENTER GROUP RETURN,2023-09-30,3022239,252416462,1323156428,-373098,0
383646817,1,OCHSNER AMERICAN LEGION HOSPITAL,559074,1106196,74160682,LAFAYETTE GENERAL HEALTH SYSTEM INC,2022-12-31,186460,2839739,209615515,372614,0
862614124,1,DEACONNESS UNION COUNTY HOSPITAL,600621,1010037,23790089,DEACONESS UNION COUNTY HOSPITAL INC,2023-09-30,230526,265545,22895067,370095,0
390806395,1,HOLY FAMILY MEMORIAL INC,778875,1893473,110462417,HOLY FAMILY MEMORIAL INC,2023-06-30,410052,12132220,118572494,368823,0
381368347,1,OAKLAWN HOSPITAL,919535,2759576,178698575,ELLA E M BROWN CHARITABLE CIRCLE,2023-03-31,551908,11096290,184829698,367627,0
042103575,1,BAYSTATE FRANKLIN MEDICAL CENTER,312559,1586302,128288403,BAYSTATE FRANKLIN MEDICAL CENTER,2023-09-30,679577,9452201,128158279,-367018,0
836000182,1,HOT SPRINGS COUNTY MEMORIAL,180089,1235728,38604257,Hot Springs County Hospital District,2023-06-30,546656,2955693,38254836,-366567,0
310949874,1,MONROE COUNTY MEDICAL CENTER,78908,521071,22663866,MONROE MEDICAL FOUNDATION INC,2023-02-28,445296,880348,21844909,-366388,0
020315693,1,CATHOLIC MEDICAL CENTER,6167600,9446180,516926781,Catholic Medical Center,2023-09-30,5802267,39476586,530973938,365333,0
362200248,1,LORETTO HOSPITAL,1421553,1639804,77572197,LORETTO HOSPITAL,2023-06-30,1784911,7254747,78317138,-363358,0
956130458,1,EISENHOWER MEDICAL CENTER,755979,3119150,1250935000,Eisenhower Medical Center,2023-06-30,1118896,60412598,1155490167,-362917,0
042126583,1,ATHOL MEMORIAL HOSPITAL,62473,245789,40459943,Athol Memorial Hospital,2023-09-30,425227,1310119,40459944,-362754,0
640741047,1,TISHOMINGO HEALTH SERVICES,1312335,2140612,18403750,Tishomingo Health Services Inc,2023-09-30,952518,952518,18550662,359817,0
580566121,4,BROOKS COUNTY HOSPITAL,16341482,27825309,401066670,JOHN D ARCHBOLD MEMORIAL,2023-09-30,15984641,59246310,400398243,356841,0
361564290,1,NORWEGIAN AMERICAN HOSPITAL,2728861,3293023,142504363,HUMBOLDT PARK HEALTH,2023-09-30,3085083,3539650,146666772,-356222,0
311551871,1,HARVARD MEMORIAL HOSPITAL,419678,1258927,25722721,Mercy Harvard Hospital Inc,2023-06-30,65267,4146313,29721024,354411,0
452998842,1,MERCY HOSPITAL LOGAN COUNTY,825593,1618345,23005112,MERCY HOSPITAL LOGAN COUNTY INC,2023-06-30,472371,519384,23599963,353222,0
237067206,1,MISSISSIPPI METHODIST REHAB CENTER,1066089,1650127,72923166,MISSISSIPPI METHODIST HOSPITAL,2023-06-30,1416351,3503632,69541125,-350262,0
222519813,1,BAYSTATE WING HOSPITAL & MEDICAL CTR,333190,1947867,108477220,BAYSTATE WING HOSPITAL CORPORATION,2023-09-30,681153,13690048,108219048,-347963,0
391030310,1,WATERTOWN REGIONAL MEDICAL CENTER,729816,1606059,107404512,GREATER WATERTOWN COMMUNITY HEALTH,2023-09-30,382055,2040053,26379805,347761,0
540549603,1,CARILION GILES COMMUNITY HOSPITAL,397730,1544917,94238821,Carilion Giles Community Hospital,2023-09-30,744328,2095625,98740788,-346598,0
900759236,3,WESTMORELAND REGIONAL  HOSPITAL,2763295,6996216,496659258,EXCELA HEALTH GROUP,2023-06-30,2417090,30080557,512755567,346205,0
240795411,1,EVANGELICAL COMMUNITY HOSPITAL,473939,1147332,219880151,EVANGELICAL COMMUNITY HOSPITAL,2023-06-30,129973,15688973,226695949,343966,0
930391614,1,ST. ANTHONY HOSPITAL,808444,2681537,96651070,ST ANTHONY HOSPITAL,2023-06-30,1150472,2201782,92045053,-342028,0
361703630,1,ROSELAND COMMUNITY HOSPITAL,338813,682091,74015772,ROSELAND COMMUNITY HOSPITAL ASSOCIATION,2023-03-31,0,0,76886847,338813,0
390806250,1,DIVINE SAVIOR HOSPITAL,852568,1827145,81197813,DIVINE SAVIOR HEALTHCARE INC,2023-06-30,514551,9074718,92576474,338017,0
640751410,1,PONTOTOC HEALTH SERVICES,2188441,3512861,27708741,Pontotoc Health Services Inc,2023-09-30,1854744,1854744,27882049,333697,0
593122517,1,DOCTORS MEMORIAL,419866,713226,9979915,DOCTORS' MEMORIAL HOSPITAL INC,2023-05-31,89877,381589,21700039,329989,0
640663760,1,BAPTIST MEM HOSPITAL BOONEVILLE,1272066,1769605,23697795,BAPTIST MEMORIAL HOSPITAL-BOONEVILLE,2023-09-30,945503,1202333,24550517,326563,0
910565539,1,VIRGINIA MASON MEDICAL CENTER,6954309,15293958,1406544043,VIRGINIA MASON MEDICAL CENTER,2023-06-30,6628154,55524964,1284754570,326155,0
450226553,1,MERCY HOSPITAL OF VALLEY CITY,478036,727838,13978327,MERCY HOSPITAL OF VALLEY CITY,2023-06-30,152694,347114,13285786,325342,0
370661236,1,ST. FRANCIS HOSPITAL,448516,1031853,51602090,St Francis Hospital Sisters of the Third Order of St Francis,2023-06-30,123276,557838,50326095,325240,0
383647394,1,PHOEBE WORTH MEDICAL CENTER,2402071,3502814,21662776,PHOEBE WORTH MEDICAL CENTER INC,2023-07-31,2081437,2542095,20904699,320634,0
222520073,1,HOLYOKE MEDICAL CENTER,715978,3220268,238113896,Holyoke Medical Center Inc,2023-09-30,396468,17723915,248612084,319510,0
411865315,1,MELROSE AREA HOSPITAL CENTRACARE,524376,682209,45951376,CENTRACARE HEALTH SYSTEM - MELROSE,2023-06-30,205184,1868083,52399778,319192,0
390807060,1,SACRED HEART HOSPITAL,1203491,2311243,251523762,Sacred Heart Hospital of Hospital Sisters of Third Order of St Francis,2023-06-30,1521533,29663228,244515097,-318042,0
250965598,1,WARREN GENERAL HOSPITAL,390767,832136,99852344,WARREN GENERAL HOSPITAL,2023-06-30,73219,7551628,97370064,317548,0
540480606,1,CARILION FRANKLIN MEMORIAL HOSPITAL,650849,1825227,67149628,Carilion Franklin Memorial Hospital,2023-09-30,967448,1280812,72525268,-316599,0
951656366,1,PIH HEALTH GOOD SAMARITAN HOSPITAL,4819858,5782053,409469213,PIH HEALTH GOOD SAMARITAN HOSPITAL,2023-09-30,5133470,67798609,411417696,-313612,0
454243702,1,ASCENSION ST. VINCENT FISHERS,881341,1731018,65421455,St Vincent Fishers Hospital Inc,2023-06-30,569026,5789007,60695855,312315,0
471156297,1,MUNSON HEALTHCARE CADILLAC HOSPITAL,442196,1395231,124855061,MUNSON HEALTHCARE CADILLAC,2023-06-30,129930,6817876,126619555,312266,0
300975387,1,IVINSON MEMORIAL HOSPITAL,1466456,4329253,122444694,IVINSON MEMORIAL HOSPITAL,2023-06-30,1778604,7113205,126708145,-312148,0
640881013,1,MS BAPTIST MEDICAL CENTER,12955006,20844356,503184772,MISSISSIPPI BAPTIST MEDICAL CENTER INC,2023-09-30,12645278,64400132,501146127,309728,0
710689680,1,MERCY HOSPITAL OZARK,589731,1087790,11445253,MERCY HOSPITAL OZARK,2023-06-30,280164,453923,11732263,309567,0
870419324,1,CENTRAL VALLEY MEDICAL CENTER,699453,1617699,64558303,Central Valley Medical Center,2023-06-30,393538,6707265,58475749,305915,0
410695598,1,ST. FRANCIS MEDICAL CENTER,662439,1082127,29792147,ST FRANCIS MEDICAL CENTER,2023-06-30,358397,2097918,20210286,304042,0
716044543,1,CHAMBERS MEMORIAL HOSPITAL,644708,1011206,23933809,JOHN ED CHAMBERS MEMORIAL HOSPITAL INC,2023-06-30,343568,1454366,23307288,301140,0
060646678,1,CHARLOTTE HUNGERFORD HOSPITAL,1959107,3176154,189763897,The Charlotte Hungerford Hospital,2023-09-30,1659272,10128276,199894192,299835,0
640333594,1,KINGS DAUGHTERS MEDICAL CENTER,534447,3372048,95956552,KINGS DAUGHTERS MEDICAL CENTER,2023-09-30,831418,7727335,95947352,-296971,0
470542043,1,COLUMBUS COMMUNITY HOSPITAL,676319,3795011,149638235,COLUMBUS COMMUNITY HOSPITAL INC,2023-04-30,382759,6771976,149511459,293560,0
420680407,1,SOUTHEAST IOWA REGIONAL MEDICAL CTR,4288060,8459903,401983256,SOUTHEAST IOWA REGIONAL MEDICAL,2023-06-30,4581205,30537052,380420311,-293145,0
840563230,1,VAIL VALLEY MEDICAL CENTER,375669,17220340,303155524,VAIL CLINIC INC,2023-10-31,668382,34323928,405698317,-292713,0
480958974,1,KANSAS SURGERY & RECOVERY CENTER,207870,541549,54466014,ASCENSION VIA CHRISTI HEALTH PARTNERS INC,2023-06-30,500323,1991431,35409508,-292453,0
160743310,1,ST. JAMES HOSPITAL,386919,866341,60052019,ST JAMES HOSPITAL,2023-06-30,677226,7500380,58936495,-290307,0
621113167,1,BAPTIST MEM HOSPITAL TIPTON COUNTY,5175948,7392962,204306087,BAPTIST MEMORIAL HOSPITAL-TIPTON INC,2023-09-30,5465971,13826291,206478618,-290023,0
251512436,1,MEADVILLE MEDICAL CENTER,1226625,2491532,260437374,MEADVILLE MEDICAL CENTER,2023-06-30,937171,30072920,244896471,289454,0
520607945,1,UNION HOSPITAL OF CECIL COUNTY,1562462,2596547,193170695,UNION HOSPITAL OF CECIL COUNTY INC,2023-06-30,1274789,13477249,192419807,287673,0
411884597,1,PINE MEDICAL CENTER,485839,809244,22705494,PINE MEDICAL CENTER,2023-06-30,198385,1637460,22331162,287454,0
810224734,1,BEARTOOTH BILLINGS CLINIC,0,645829,20700646,MEMORIAL HOSPITAL ASSOCIATION,2023-06-30,286238,581951,20053755,-286238,0
850141285,1,CIBOLA GENERAL HOSPITAL,1013905,2921554,58077661,CIBOLA GENERAL HOSPITAL,2023-06-30,729891,1998275,50334189,284014,0
860260959,1,LA PAZ REGIONAL HOSPITAL,463062,1301511,37615442,La Paz Regional Hospital,2023-09-30,179091,8575300,37615445,283971,0
382908586,1,ASPIRUS IRONWOOD HOSPITAL,688941,1508054,71504033,ASPIRUS IRONWOOD HOSPITAL & CLINICS INC,2023-06-30,407966,5091746,69805416,280975,0
596031176,1,DOCTORS MEMORIAL HOSPITAL,0,176773,21928230,HOLMES COUNTY HOSPITAL CORPORATION,2023-09-30,280204,1027345,27078865,-280204,0
721526400,1,WAMEGO HOSPITAL ASSOCIATION,469181,899116,14102837,Wamego Hospital Association,2023-06-30,189215,307052,14237038,279966,0
420776568,1,CHI HEALTH - MISSOURI VALLEY,503139,948597,34940139,ALEGENT HEALTH-COMMUNITY MEMORIAL,2023-06-30,224492,972544,31129047,278647,0
150346515,1,ALICE HYDE MEDICAL CENTER,504427,1802261,106342199,ALICE HYDE MEDICAL CENTER,2023-09-30,782981,16850945,105321371,-278554,0
610432526,1,CALDWELL COUNTY HOSPITAL,36557,945571,28005815,CALDWELL COUNTY HOSPITAL INC,2023-06-30,314601,837095,29442819,-278044,0
832249459,1,MOSAIC MEDICAL CENTER - MARYVILLE,2247606,3072835,105252002,Mosaic Medical Center Maryville,2023-06-30,2525013,7405777,91433911,-277407,0
460234354,1,AVERA GETTYSBURG HOSPITAL,362521,365004,12874681,Avera Gettysburg,2023-06-30,87000,4330992,12769963,275521,0
470443636,1,SAINT MARYS HOSPITAL,525370,1244460,38318216,ST MARY'S COMMUNITY HOSPITAL,2023-06-30,252430,2244050,38155965,272940,0
060646718,1,MIDDLESEX HOSPITAL,1823961,4303111,485733000,MIDDLESEX HOSPITAL,2023-09-30,1551780,70813446,485711932,272181,0
430666765,1,RANKEN JORDAN,0,0,57911285,THE RANKEN-JORDAN HOME FOR CONVALESCENT CRIPPLED CHILDREN,2023-06-30,272016,872906,52340897,-272016,0
581737573,1,ST THOMAS HICKMAN HOSPITAL,271416,1175656,17900237,Saint Thomas Hickman Hospital,2023-06-30,0,1764585,20694545,271416,0
570468486,1,WILLIAMSBURG REGIONAL HOSPITAL,0,654829,8676352,WILLIAMSBURG REGIONAL HOSPITAL,2023-09-30,269919,1853135,15062551,-269919,0
850289839,1,HOLY CROSS HOSPITAL,311474,3123785,93071324,TAOS HEALTH SYSTEMS INC,2023-05-31,42308,5275581,87516328,269166,0
380593405,1,METROPOLITAN HOSPITAL,3658067,7693459,599106101,METROPOLITAN HOSPITAL,2023-06-30,3926056,21341960,583399784,-267989,0
463851119,1,MERCY HOSPITAL BOONEVILLE,573780,1167223,16070446,MERCY HOSPITAL BOONEVILLE,2023-06-30,305836,511125,15975827,267944,0
843156881,1,AVERA GRANITE FALLS,284692,491321,28266387,Avera Granite Falls,2023-06-30,18667,6189495,28486949,266025,0
820558836,1,LISBON AREA HEALTH SERVICES,406603,664397,13559995,LISBON AREA HEALTH SERVICES,2023-06-30,140731,181334,12337778,265872,0
710557895,1,MERCY HOSPITAL WALDRON,521523,1004664,12252376,MERCY HOSPITAL WALDRON,2023-06-30,255875,255875,11201035,265648,0
060646599,1,DAY KIMBALL HOSPITAL,0,0,129889450,DAY KIMBALL HEALTHCARE INC,2023-09-30,262872,18215075,130715343,-262872,0
351343019,1,ASCENSION ST. VINCENT WARRICK,485265,879355,21276800,ST MARYS WARRICK HOSPITAL INC,2023-06-30,222717,3937705,20437294,262548,0
813257997,1,BMH - CALHOUN,669418,1278752,23754196,BAPTIST MEMORIAL HOSPITAL-CALHOUN INC,2023-09-30,407410,2011494,15368141,262008,0
520591483,1,MT WASHINGTON PEDIATRICS,0,0,0,Mt Washington Pediatric Hospital Inc,2023-06-30,260131,1252880,69785395,-260131,inf
020222152,1,LITTLETON REGIONAL HEALTHCARE,734647,3366808,117654163,Littleton Hospital Association,2023-09-30,474766,17020089,117934604,259881,0
621166050,1,BAPTIST MEM HOSPITAL HUNTINGDON,1243569,1719989,28259916,BAPTIST MEMORIAL HOSPITAL-,2023-09-30,1500410,3496728,28236514,-256841,0
310678022,1,SOUTHERN OHIO MEDICAL CENTER,3975377,4740518,473295334,SOUTHERN OHIO MEDICAL CENTER,2023-06-30,3720187,68799291,463374221,255190,0
710797499,1,BRADLEY COUNTY MEDICAL CENTER,286296,1826062,25904732,BRADLEY COUNTY MEDICAL CENTER,2023-09-30,33218,1190896,28901077,253078,0
431656689,1,COX-MONETT HOSPITAL,1473676,2932095,62690307,COX-MONETT HOSPITAL INC,2023-09-30,1725407,9075998,62924019,-251731,0
