ein,ccn_count,hospital_name,hcris_charity_care_cost,hcris_uncompensated_care_cost,hcris_total_operating_expenses,sched_h_organization_name,sched_h_tax_period_end,sched_h_financial_assistance_at_cost,sched_h_total_community_benefit,sched_h_total_expenses,charity_gap,community_benefit_pct_of_expenses
741152597,8,MEMORIAL HERMANN KINGWOOD,427985312,532498326,6867802978,Memorial Hermann Health System,2023-06-30,307172517,470246420,6952309636,120812795,0
620646012,1,ST JUDE CHILDRENS RESEARCH HOSPITAL,0,0,0,ST JUDE CHILDREN'S RESEARCH HOSPITAL,2023-06-30,112089959,839510441,1519049173,-112089959,inf
741109643,11,ASCENSION SETON EDGAR B DAVIS,223889801,256467574,2879522006,ASCENSION SETON,2023-06-30,132519795,209760659,2631998802,91370006,0
060646652,1,YALE NEW HAVEN HOSPITAL,35568680,58874879,4113794015,YALE NEW HAVEN HOSPITAL,2023-09-30,113100512,618171998,4112468772,-77531832,0
941196203,22,ARIZONA ORTHOPEDIC SURGICAL HOSPITAL,210333410,283920283,9770248076,DIGNITY HEALTH,2023-06-30,136855373,890087890,10126687245,73478037,0
591479658,3,ADVENTHEALTH WAUCHULA,227942812,255385581,5935769798,Adventist Health SystemSunbelt Inc,2022-12-31,156466629,668155378,5809231036,71476183,0
364724966,8,VALLEY WEST COMMUNITY HOSPITAL,138911025,163499920,6766342274,Northwestern Memorial HealthCare Group,2023-08-31,67545942,666870014,8938053992,71365083,0
591726273,2,ORLANDO HEALTH,143177373,156777989,3254040908,Orlando Health Inc,2023-09-30,72596934,279880075,3288156944,70580439,0
314394942,5,RIVERSIDE METHODIST HOSPITAL,136771789,149019825,3506278984,OhioHealth Corporation,2023-06-30,68402444,278559728,3824186620,68369345,0
751837454,15,TEXAS SPINE AND JOINT HOSPITAL,109139426,160724735,2543897698,Baylor University Medical Center,2023-06-30,42340008,98666053,1308713628,66799418,0
581954432,5,NORTHSIDE HOSPITAL FORSYTH,293086930,373163258,5971277169,NORTHSIDE HOSPITAL INC,2023-09-30,358575324,446531457,6737049547,-65488394,0
592142859,1,SHANDS JACKSONVILLE MEDICAL CENTER,76639228,88304215,1010802506,SHANDS JACKSONVILLE MEDICAL CENTER INC,2023-06-30,11408482,86792939,970738047,65230746,0
520591656,1,THE JOHNS HOPKINS HOSPITAL,0,0,3282484000,THE JOHNS HOPKINS HOSPITAL,2023-06-30,63958981,359693954,3085824238,-63958981,0
840405257,12,SALT LAKE REGIONAL MEDICAL CENTER,97188840,106211325,3008458308,Catholic Health Initiatives Colorado,2023-06-30,38689202,222265354,2453902240,58499638,0
593458145,1,TAMPA GENERAL HOSPITAL,102388256,103038122,2146142409,FLORIDA HEALTH SCIENCES CENTER INC,2023-09-30,51039498,301831677,2174424743,51348758,0
610444707,8,BAPTIST HEALTH HARDIN,27690414,46338607,3857460485,Baptist Healthcare System Inc,2023-08-31,70869847,294837314,3533165433,-43179433,0
750800661,8,METHODIST MCKINNEY HOSPITAL,152621555,205332975,2081733463,Methodist Hospitals of Dallas,2023-09-30,110100333,236358642,1748411893,42521222,0
590910342,1,BAPTIST HOSPITAL,27306450,46766454,1606122131,Baptist Hospital of Miami Inc,2023-09-30,69100717,168060273,1893361379,-41794267,0
741100555,1,TEXAS CHILDRENS HOSPITAL,0,0,3638037115,TEXAS CHILDREN'S HOSPITAL,2023-09-30,41239064,589882074,3644874281,-41239064,0
742577746,1,DRISCOLL CHILDRENS HOSPITAL,0,0,578676933,Driscoll Children's Hospital,2023-08-31,39200012,167232568,542186982,-39200012,0
951683875,1,CITY OF HOPE NATIONAL MEDICAL CTR,0,0,2377313850,CITY OF HOPE NATIONAL MEDICAL CENTER,2023-09-30,38243361,153553905,2391958398,-38243361,0
440661018,2,UNIVERSITY HEALTH TRUMAN MED CENTER,37689620,60238846,903507662,TRUMAN MEDICAL CENTER INCORPORATED,2023-06-30,0,35374879,767269440,37689620,0
440605373,2,CHILDRENS MERCY HOSPITAL,0,0,1118702926,The Children's Mercy Hospital,2023-06-30,36255967,244025263,1778140684,-36255967,0
580566256,2,EMORY UNIVERSITY HOSPITAL,108142994,158324090,3289251069,Emory University,2023-08-31,71899727,963757565,6019904381,36243267,0
481172106,2,ROCK REGIONAL HOSPITAL,50618598,66103986,761180156,ASCENSION VIA CHRISTI HOSPITALS WICHITA INC,2023-06-30,14805683,37339131,710628155,35812915,0
900656139,10,MARTHAS VINEYARD HOSPITAL,76533328,127230151,12503104703,MASS GENERAL BRIGHAM INCORPORATED &,2023-09-30,110886113,1426126688,21584405066,-34352785,0
811723202,7,OCONEE MEMORIAL HOSPITAL,143172333,186286082,2179440458,Prisma Health-Upstate,2023-09-30,109136438,188815543,2274451398,34035895,0
592650456,1,LAKELAND REGIONAL MED CTR,49263370,65303442,942050457,Lakeland Regional Medical Center Inc,2023-09-30,15629064,103250830,1039271249,33634306,0
133971298,1,NYU LANGONE HOSPITALS,109219081,112318278,8956110402,NYU LANGONE HOSPITALS,2023-08-31,76960516,1470781277,7561157803,32258565,0
582032904,1,KENNESTONE HOSPITAL,92510989,109055962,1491697794,KENNESTONE HOSPITAL INC,2023-06-30,60753000,94673482,1374071696,31757989,0
521341890,1,JOHNS HOPKINS BAYVIEW MED. CTR.,0,0,788964000,JOHNS HOPKINS BAYVIEW,2023-06-30,31411427,103985679,767179381,-31411427,0
421707837,1,HENNEPIN COUNTY MEDICAL CENTER,64316586,69088367,1433229000,HENNEPIN HEALTHCARE SYSTEM INC,2022-12-31,34360910,68272454,1457616429,29955676,0
580566213,1,PIEDMONT HOSPITAL INC.,45167015,52953877,1364294954,PIEDMONT HOSPITAL INC,2023-06-30,17693662,52515556,1355182449,27473353,0
910939479,10,SACRED HEART MED CTR - UNIVERSITY,81177297,94938970,3440791041,PEACEHEALTH,2023-06-30,54021441,319382533,3555611223,27155856,0
566017737,2,WAKEMED RALEIGH CAMPUS,89357830,121362851,1579331651,WakeMed,2023-09-30,116034706,136165408,2092838776,-26676876,0
593238634,1,MOFFITT CANCER CENTER,0,123380,1843099905,H LEE MOFFITT CANCER CENTER AND,2023-06-30,26674853,66174739,1622473343,-26674853,0
750818178,1,TEXAS SCOTTISH RITE HOSPITAL FOR CHI,0,0,0,Texas Scottish Rite Hospital for Crippled Children,2023-09-30,26552358,102462326,276836732,-26552358,inf
741166904,1,SCOTT AND WHITE MEMORIAL HOSPITAL,72152696,84260029,2106936951,Scott & White Memorial Hospital,2023-06-30,48325622,142640981,1378273525,23827074,0
720423651,3,SURGICAL SPECIALTY CENTER BATON ROUG,27230330,48158031,1512282873,OUR LADY OF THE LAKE HOSPITAL INC,2023-06-30,3449685,41399308,1591541146,23780645,0
911858433,2,BELLEVUE MEDICAL CENTER,39562766,55455056,2479982475,The Nebraska Medical Center,2023-06-30,16246065,370305091,2040013770,23316701,0
910564491,5,HIGHLINE MEDICAL CENTER,42779953,55029418,1766468275,FRANCISCAN HEALTH SYSTEM,2023-06-30,20931998,187563408,1732889119,21847955,0
231689692,1,LEHIGH VALLEY,27833874,43399330,3328081627,LEHIGH VALLEY HOSPITAL,2023-06-30,6056361,291635945,3080765011,21777513,0
912155626,4,HEALTHALLIANCE-CLINTON,27791018,42785092,2940210780,UMass Memorial Health Care Inc & Affiliates,2023-09-30,6388549,381229447,3580384522,21402469,0
521362793,1,UNIVERSITY OF MARYLAND MED SYS,0,0,1224714940,University of Maryland Medical System Corporation,2023-06-30,21124030,260975315,2149624123,-21124030,0
311439334,3,ST. ANNS HOSPITAL,39302025,49980465,1279234294,MOUNT CARMEL HEALTH SYSTEM,2023-06-30,18285081,121301867,1412329535,21016944,0
741303720,1,BAPTIST BEAUMONT HOSPITAL,28224028,31305727,373577128,Baptist Hospitals of Southeast Texas,2023-06-30,7428535,9362915,344607263,20795493,0
352528741,4,VANDERBILT UNIVERSITY MEDICAL CENTER,143286885,166201776,7266410607,Vanderbilt University Medical Center,2023-06-30,162947963,616426371,6812818433,-19661078,0
060646659,1,GREENWICH HOSPITAL,3984548,8616527,531299537,GREENWICH HOSPITAL,2023-09-30,23567829,56070872,534503374,-19583281,0
520738041,2,HOLY CROSS HOSPITAL,0,9377,659229848,HOLY CROSS HEALTH INC,2023-06-30,19504698,43779674,695838766,-19504698,0
831605004,3,OCHSNER LSU HEALTH - ST MARY MED CTR,34437662,40978691,1040409630,OCHSNER LSU HEALTH SYSTEM OF NORTH,2023-06-30,15223012,101053826,1064566596,19214650,0
750827446,1,HENDRICK MEDICAL CENTER,23717330,41480180,752211425,Hendrick Medical Center,2023-08-31,4523276,10205680,698866181,19194054,0
581588823,1,THE MOSES H. CONE MEMORIAL HOSPITAL,45183745,81627097,1370576815,MOSES H CONE MEMORIAL HOSPITAL,2023-09-30,63479590,116427901,1745593096,-18295845,0
582200195,1,PIEDMONT HENRY HOSPITAL  INC.,25789837,33895971,402721904,PIEDMONT HENRY HOSPITAL INC,2023-06-30,7936638,11637104,496914757,17853199,0
590747311,1,BAPTIST MEDICAL CENTER,52563335,74199206,1924231429,Southern Baptist Hospital of Florida Inc,2023-09-30,34774425,99198986,1921887868,17788910,0
710236857,1,ARKANSAS CHILDRENS HOSPITAL,0,0,738952079,ARKANSAS CHILDREN'S HOSPITAL,2023-06-30,17728336,96476004,758664258,-17728336,0
231352213,1,ST. LUKES HOSPITAL,21759624,26450975,1160605569,ST LUKE'S HOSPITAL OF BETHLEHEM PA,2023-06-30,4252669,222817742,1410835435,17506955,0
582296052,3,PRISMA HEALTH RICHLAND HOSPITAL,63814001,99238759,1321586397,Prisma Health-Midlands,2023-09-30,46492841,76754334,1408612955,17321160,0
591943502,1,UF HEALTH SHANDS,74216252,102993708,2117195245,SHANDS TEACHING HOSPITAL AND CLINICS INC,2023-06-30,56977220,261019715,2262526320,17239032,0
042774441,1,CHILDRENS HOSPITAL CORPORATION,0,0,2405492735,Children's Hospital Corporation,2023-09-30,17153580,423323873,2874957146,-17153580,0
320197974,1,WESTERN REGIONAL MEDICAL CENTER,18050546,18464191,137364298,WESTERN REGIONAL MEDICAL CENTER INC,2023-09-30,1133892,4466224,134761934,16916654,0
582179986,1,PIEDMONT ATHENS REGIONAL MEDICAL CE,43228616,49543275,752871916,PIEDMONT ATHENS REGIONAL MEDICAL CENTER INC,2023-06-30,26767769,52006739,684307461,16460847,0
208295721,20,UPMC BEDFORD,59883687,91028986,9572499942,UPMC GROUP,2023-06-30,76299328,1413185473,22671786620,-16415641,0
060646704,1,LAWRENCE & MEMORIAL HOSPITAL,4783389,8746761,468963139,LAWRENCE MEMORIAL HOSPITAL INC,2023-09-30,21089082,85368011,464752849,-16305693,0
582322328,1,PIEDMONT FAYETTE HOSPITAL INC.,25020958,31247027,464454793,FAYETTE COMMUNITY HOSPITAL INC,2023-06-30,8979824,13840395,536308338,16041134,0
231352204,1,READING HOSPITAL AND MEDICAL CENTER,9845290,23951883,1154593620,READING HOSPITAL,2023-06-30,25664707,159403402,1209551696,-15819417,0
590634434,4,ASCENSION SACRED HEART PENSACOLA,75939147,90857854,1586870762,Sacred Heart Health System Inc,2023-06-30,60337779,144280576,1534567941,15601368,0
752051646,1,COOK CHILDRENS MEDICAL CENTER,26777615,50895768,1449830341,Cook Children's Medical Center,2023-09-30,11319303,242837121,1521897393,15458312,0
520591531,1,UPMC-WESTERN MARYLAND CORP,0,0,374593496,UPMC WESTERN MARYLAND CORPORATION,2023-06-30,14905333,76241581,357819842,-14905333,0
824372339,1,ADVENTHEALTH OCALA,29027660,32112317,432396233,Florida Hospital Ocala Inc,2022-12-31,14156663,51342607,413661848,14870997,0
900790361,4,ST. JOSEPHS OF ATLANTA,54893288,90604530,1479061335,EMORY GROUP RETURN,2023-08-31,40034072,148217612,3995036959,14859216,0
590872594,1,SOUTH MIAMI HOSPITAL,10329537,26544195,618952164,SOUTH MIAMI HOSPITAL INC,2023-09-30,25156889,68027547,747629626,-14827352,0
370813229,13,OSF SAINT CLARE MEDICAL CENTER,42410656,57474110,2882763899,OSF Healthcare System,2023-09-30,27598917,206370609,3012001625,14811739,0
430653493,2,MERCY HOSPITAL - ST. LOUIS,32851560,45445802,1478494601,MERCY HOSPITALS EAST COMMUNITIES,2023-06-30,18509113,132736295,1486584712,14342447,0
870982886,1,PIEDMONT EASTSIDE MEDICAL CENTER,18447920,23975387,280587413,Piedmont Eastside Hospital Inc,2023-06-30,4510995,13686844,290427995,13936925,0
860110232,1,FLAGSTAFF MEDICAL CENTER,8202421,14458227,510627598,Flagstaff Medical Center,2023-06-30,22038012,109423484,484067899,-13835591,0
581694098,1,NORTHEAST GEORGIA MEDICAL CENTER,85424304,104023609,1566181162,NORTHEAST GEORGIA MEDICAL CENTER INC,2023-09-30,71638424,197494877,1712828559,13785880,0
910564748,1,SEATTLE CHILDRENS HOSPITAL,0,-1908,1799623994,SEATTLE CHILDREN'S HOSPITAL,2023-09-30,13757000,499886937,2309040702,-13757000,0
810231784,1,BILLINGS CLINIC,5807443,8237627,512318998,BILLINGS CLINIC,2023-06-30,19404948,76661012,1101625884,-13597505,0
870963633,1,PIEDMONT CARTERSVILLE MEDICAL CENTER,18728456,22113971,184845736,Piedmont Cartersville Hospital Inc,2023-06-30,5327896,11310019,199064234,13400560,0
560585243,1,PITT COUNTY MEMORIAL HOSPITAL INC,58154069,84059584,1545721878,Pitt County Memorial Hospital Inc,2023-09-30,44910860,112749083,1643233968,13243209,0
520795508,9,MORGAN CO. ARH,3281350,10400042,741282412,APPALACHIAN REGIONAL HEALTHCARE,2023-06-30,16520408,38753348,901932107,-13239058,0
845074208,1,BAYFRONT HEALTH ST. PETERSBURG,17558544,19863373,341803349,OHI West Inc,2023-09-30,4351102,48883365,342974365,13207442,0
060646554,1,BRIDGEPORT HOSPITAL,19539141,26118693,902985820,BRIDGEPORT HOSPITAL,2023-09-30,32703486,145839705,897527103,-13164345,0
741109636,1,ASCENSION PROVIDENCE,20318903,26254568,313224209,ASCENSION PROVIDENCE,2023-06-30,7326135,8745329,322905352,12992768,0
231352160,4,PHYSICIANS CARE SURGICAL HOSPITAL,18602674,25877329,1649254312,Main Line Hospitals Inc,2023-06-30,5812416,112873979,1673232141,12790258,0
760591590,2,CHRISTUS HOSPITAL,45855754,49499237,448734456,Christus Health Southeast Texas,2023-06-30,33148370,35635246,447133545,12707384,0
362235165,4,PRESENCE RESURRECTION MEDICAL CENTER,29081190,33764052,1187205069,Presence Chicago Hospitals Network,2023-06-30,16451612,64565539,1323587237,12629578,0
540696355,2,UVA HEALTH HAYMARKET MEDICAL CENTER,13660519,13865518,335883225,UVA PRINCE WILLIAM MEDICAL CENTER,2023-06-30,1147969,6053400,321086555,12512550,0
020222140,1,MARY HITCHCOCK MEMORIAL HOSP,19932525,27368431,2242355383,Mary Hitchcock Memorial Hospital,2023-06-30,7449779,237678870,1923168492,12482746,0
454364243,2,CEDAR PARK REGIONAL MEDICAL CENTER,15130733,20316178,273471037,Ascension Texas,2023-06-30,2731794,2732229,133448654,12398939,0
520607949,1,MERITUS MEDICAL CENTER,0,0,435535757,MERITUS MEDICAL CENTER INC,2023-06-30,12269867,66518506,523726941,-12269867,0
231352685,1,HOSPITAL OF THE UNIV OF PENNA,24144752,31563713,4218323689,TRUSTEES OF THE UNIVERSITY OF PENNSYLVANIA,2023-06-30,11963060,429232560,9264364000,12181692,0
420698295,1,MERCY MEDICAL CENTER,9511330,11937740,475591378,MERCY MEDICAL CENTER,2023-06-30,21603918,38203783,456035429,-12092588,0
043314093,1,BOSTON MEDICAL CENTER,111461030,128152610,2417588966,BOSTON MEDICAL CENTER CORPORATION,2023-09-30,99453635,239716696,2418812155,12007395,0
205077249,1,PIEDMONT NEWNAN HOSPITAL INC.,18496742,22053524,304638628,PIEDMONT NEWNAN HOSPITAL INC,2023-06-30,6623524,11662891,352810365,11873218,0
465338502,2,ALBERT EINSTEIN MEDICAL CENTER,12991069,17300962,1321863310,ALBERT EINSTEIN HEALTHCARE NETWORK GROUP,2023-06-30,1249043,154595727,1574451391,11742026,0
382113393,6,LAKE HURON MEDICAL CENTER,23289919,38114522,3147791106,TRINITY HEALTH - MICHIGAN,2023-06-30,11661672,121143022,2880789507,11628247,0
521638026,1,DOCTORS COMMUNITY HOSPITAL,0,0,258085906,LUMINIS HEALTH DOCTORS COMMUNITY MEDICAL,2023-06-30,11564488,30507958,246853240,-11564488,0
560530233,1,S.E. REGL MEDICAL CENTER,4351964,12956870,344828000,SOUTHEASTERN REGIONAL MEDICAL,2023-06-30,15839430,52267427,336545602,-11487466,0
042103881,1,BETH ISRAEL DEACONESS MEDICAL CENTER,12385414,25103139,2574253470,BETH ISRAEL DEACONESS MEDICAL CENTER,2023-09-30,23848613,265854608,2574202267,-11463199,0
751008430,1,BAYLOR S&W ALL SAINTS MEDICAL CENTER,24367565,35057300,522415347,Baylor All Saints Medical Center,2023-06-30,12971877,30995765,537231911,11395688,0
320265031,1,MAINEGENERAL MEDICAL CENTER,389832,8087550,686056024,MaineGeneral Health and Affiliates,2023-06-30,11734935,50424805,708009580,-11345103,0
581685139,1,PIEDMONT COLUMBUS REGIONAL MIDTOWN,24870319,30429383,495765678,The Medical Center Inc,2023-06-30,13563094,39110472,492732330,11307225,0
951644600,1,CEDARS-SINAI MEDICAL CENTER,48757767,53990321,4510162063,CEDARS-SINAI MEDICAL CENTER,2023-06-30,37564702,492280336,4157965052,11193065,0
710236917,2,ST VINCENT NORTH,11553489,12900173,644168181,ST VINCENT INFIRMARY MEDICAL CENTER,2023-06-30,407306,18703215,613387203,11146183,0
570370242,1,MCLEOD REGIONAL MEDICAL CENTER,35629827,48054794,858873651,MCLEOD REGIONAL MEDICAL CENTER OF,2023-09-30,24676264,58067738,979916880,10953563,0
941429628,1,STANFORD HEALTH CARE TRI-VALLEY,12959850,14884316,525208690,STANFORD HEALTH CARE TRI-VALLEY,2023-08-31,2019688,42011475,457725261,10940162,0
264572436,1,SOUTHEASTERN REGIONAL MEDICAL CENTER,17497920,18902229,217915949,SOUTHEASTERN REGIONAL MEDICAL CENTER INC,2023-09-30,6615705,8483785,212793953,10882215,0
581790149,1,TANNER MEDICAL CENTER,21717925,28924308,479169573,TANNER MEDICAL CENTER INC,2023-06-30,10838014,28199014,424165284,10879911,0
911935159,1,FRED HUTCHINSON CANCER CENTER,0,0,2102009267,FRED HUTCHINSON CANCER CENTER,2023-06-30,10858163,138117252,1951660593,-10858163,0
362222696,1,SWEDISHAMERICAN HOSPITAL,19581525,21734380,798087647,SwedishAmerican Hospital,2023-06-30,8823632,64195927,786870384,10757893,0
800785570,2,HIGGINS GENERAL HOSPITAL,20029776,27425993,245034624,TANNER MEDICAL CENTER GROUP RETURN,2023-06-30,9279500,19145291,398924775,10750276,0
630288864,1,ST VINCENTS BIRMINGHAM,12547040,15170854,523942485,St Vincent's Birmingham,2023-06-30,1921708,4754274,506896181,10625332,0
815009488,11,OASIS HOSPITAL,69368034,93110698,3585926820,DIGNITY COMMUNITY CARE,2023-06-30,58792641,450195767,3549273982,10575393,0
310537486,1,GOOD SAMARITAN HOSPITAL,10981878,20470153,925053459,THE GOOD SAMARITAN HOSPITAL OF,2023-06-30,456724,58697334,785057490,10525154,0
310537122,1,BETHESDA HOSPITAL,13844876,27863907,903172336,BETHESDA HOSPITAL INC,2023-06-30,3320317,41273671,777995761,10524559,0
364195126,4,PRESENCE ST. MARYS HOSPITAL,30931666,33079840,918347393,Presence Central and Suburban Hospitals Network,2023-06-30,20421336,36070056,875395401,10510330,0
820200895,1,ST. ALPHONSUS REGIONAL MED CENTER,21524844,27576099,899300830,SAINT ALPHONSUS REGIONAL MEDICAL CENTER,2023-06-30,11046699,33400497,835600436,10478145,0
946174066,1,STANFORD HEALTH CARE,23136866,26923115,7425866725,STANFORD HEALTH CARE,2023-08-31,12750465,737216726,6584068268,10386401,0
020232673,1,ELLIOT HOSPITAL,19579797,25049314,625762983,The Elliot Hospital of the City,2023-06-30,9259419,83725506,580261281,10320378,0
721025017,1,BATON ROUGE GENERAL,1807138,8006260,536140561,BATON ROUGE GENERAL MEDICAL CENTER,2023-09-30,12115682,39517879,628451995,-10308544,0
381360584,1,EDWARD W. SPARROW HOSPITAL,15173015,24690326,1769678624,EDWARD W SPARROW HOSPITAL,2023-06-30,4899592,26773212,604998614,10273423,0
953782169,1,SHARP MEMORIAL HOSPITAL,16888019,20250392,1315546999,Sharp Memorial Hospital,2023-09-30,6615181,86384333,1318965927,10272838,0
741161944,1,HILLCREST BAPTIST MEDICAL CENTER,27833099,36375119,530696651,Hillcrest Baptist Medical Center,2023-06-30,17676418,22786708,424420990,10156681,0
591006663,1,BOCA RATON REGIONAL HOSPITAL,4329855,5633224,690187786,Boca Raton Regional Hospital Inc,2023-09-30,14427728,18335297,708112381,-10097873,0
320007056,6,SHELBY MEMORIAL HOSPITAL,29320335,36232090,1040958790,OhioHealth Corporation Group Return,2023-06-30,39277912,188962765,2012252247,-9957577,0
274658935,1,MARTIN LUTHER KING COMMUNITY HOSP,21331543,21931983,418349444,MARTIN LUTHER KING JR-LOS ANGELES,2023-06-30,31137146,37930488,412570722,-9805603,0
752586857,1,BAYLOR S&W MEDICAL CENTER - IRVING,33939664,46821042,298202791,Baylor Medical Center at Irving,2023-06-30,24268783,27416175,280828367,9670881,0
440552485,1,MERCY HOSPITAL SPRINGFIELD,28581915,38295506,1105078362,Mercy Hospital Springfield,2023-06-30,18970861,96229148,1042983931,9611054,0
160743209,1,STRONG MEMORIAL HOSPITAL,31084165,43217735,3476806624,UNIVERSITY OF ROCHESTER,2023-06-30,21552117,603558384,5337555405,9532048,0
251854772,1,MILTON S. HERSHEY MEDICAL CENTER,25174382,35621018,2303807316,THE MILTON S HERSHEY MEDICAL CENTER,2023-06-30,15651833,104369075,2441217720,9522549,0
010238552,8,WALDO COUNTY GENERAL HOSPITAL,28560709,74029579,3556936451,MaineHealth,2023-09-30,37908357,371384712,3513572710,-9347648,0
420680448,1,MERCY MEDICAL CENTER-DES MOINES,14450421,20687357,1178863898,CATHOLIC HEALTH INITIATIVES - IOWA CORP,2023-06-30,5153504,48572266,962072046,9296917,0
330449527,1,GROSSMONT HOSPITAL,15284443,20049612,957884955,Grossmont Hospital Corporation,2023-09-30,6004276,49021768,961958701,9280167,0
580968382,1,COBB HOSPITAL AND MEDICAL CENTER,57273307,67466785,961313562,COBB HOSPITAL INC,2023-06-30,48033804,48454480,793674723,9239503,0
581519911,1,HAMILTON MEDICAL CENTER,7776065,29664454,358748334,HAMILTON MEDICAL CENTER INC,2023-09-30,16904149,24604229,359854691,-9128084,0
871006981,1,PIEDMONT MACON MEDICAL CENTER,14838183,16595539,255065075,Piedmont Macon Hospital Inc,2023-06-30,5725412,27312377,262221319,9112771,0
562070036,3,DUKE UNIVERSITY HOSPITAL,150273860,172961673,4889964614,DUKE UNIVERSITY HEALTH SYSTEM INC,2023-06-30,159367231,553245655,4623216546,-9093371,0
520486540,1,SINAI HOSPITAL OF BALTIMORE  INC.,0,0,979846598,SINAI HOSPITAL OF BALTIMORE INC,2023-06-30,9002625,87633009,967777126,-9002625,0
651219504,1,UCM ADVENTHEALTH BOLINGBROOK,11338965,12182868,235376377,ADVENTIST BOLINGBROOK HOSPITAL,2023-06-30,2566907,5870555,124019696,8772058,0
510217097,1,SAINT ANTHONY HOSPITAL,4980696,7169947,156135465,Saint Anthony Hospital,2023-06-30,13688140,13742802,147141571,-8707444,0
650232993,1,HOMESTEAD HOSPITAL,21905510,38834722,298669372,Homestead Hospital Inc,2023-09-30,30594442,79928908,500914192,-8688932,0
590624458,1,UNIVERSITY OF MIAMI HOSP & CLINICS,0,0,2561328821,University of Miami,2023-05-31,8643391,308374955,5495599586,-8643391,0
240795463,1,ROBERT PACKER HOSPITAL,1763181,9208928,501082359,ROBERT PACKER HOSPITAL,2023-06-30,10321035,82330873,482342900,-8557854,0
522093120,1,HOWARD COUNTY,0,0,331000618,HOWARD COUNTY GENERAL HOSPITAL INC,2023-06-30,8451962,34304253,332054923,-8451962,0
470484764,2,CHI HEALTH MERCY COUNCIL BLUFFS,23058769,31845034,770015472,ALEGENT HEALTH - BERGAN MERCY HEALTH,2023-06-30,14656670,77742469,685216987,8402099,0
730579285,1,MERCY HOSPITAL OKC,20297939,25722532,676469761,MERCY HOSPITAL OKLAHOMA CITY,2023-06-30,11899945,51049802,635710966,8397994,0
841262971,1,POUDRE VALLEY HOSPITAL,12480144,16488110,662293577,POUDRE VALLEY HEALTH CARE INC,2023-06-30,4141048,130026758,740707979,8339096,0
750974351,1,GOOD SHEPHERD MEDICAL CENTER,48712952,56077867,611706690,CHRISTUS Good Shepherd Medical Center,2023-06-30,40449960,42988934,548167173,8262992,0
752796815,1,CHRISTUS ST MICHAEL,27589577,29603240,461315011,Christus Health Ark-La-Tex,2023-06-30,19351581,34769750,434603547,8237996,0
522438452,1,WEST KENDALL BAPTIST HOSPITAL,7372292,18869422,322949685,West Kendall Baptist Hospital Inc,2023-09-30,15597098,37266350,449769901,-8224806,0
314379509,1,MARIETTA MEMORIAL HOSPITAL,7318659,15121479,567687921,MARIETTA MEMORIAL HOSPITAL,2023-09-30,15463193,74877017,481359999,-8144534,0
300999841,1,PIEDMONT ROCKDALE HOSPITAL,15392868,19108979,229373899,Piedmont Rockdale Hospital,2023-06-30,7320864,10698256,240575814,8072004,0
710294390,1,MERCY MEDICAL CENTER,19446830,26116006,369030083,MERCY HOSPITAL ROGERS,2023-06-30,11377908,35966595,371327452,8068922,0
730700090,1,SAINT FRANCIS HOSPITAL,46276102,58178472,1434966756,Saint Francis Hospital Inc,2023-06-30,38397879,165634044,1310647977,7878223,0
520610545,1,SUBURBAN HOSPITAL,0,0,390597917,SUBURBAN HOSPITAL INC,2023-06-30,7718558,34722131,377429825,-7718558,0
941634554,1,OROVILLE HOSPITAL,1108943,1242209,386767325,OROVILLE HOSPITAL,2023-11-30,8772009,25182120,385563163,-7663066,0
530196580,1,CHILDRENS HOSPITAL,0,0,1588258036,CHILDREN'S HOSPITAL,2023-06-30,7613697,211275197,1517938434,-7613697,0
362276984,2,ADVENTIST LAGRANGE MEMORIAL HOSPITAL,10041720,11169787,549700273,ADVENTIST MIDWEST HEALTH,2023-06-30,2429567,18883610,295395406,7612153,0
582026750,1,DOUGLAS HOSPITAL,21025425,24560899,237186721,DOUGLAS HOSPITAL INC,2023-06-30,13415604,13529110,200411891,7609821,0
742557820,1,PETERSON REGIONAL MEDICAL CENTER,13537100,14192382,176621984,SID PETERSON MEMORIAL HOSPITAL,2023-06-30,5931473,20303182,174830522,7605627,0
465322209,1,ST. JOSEPHS MEDICAL CENTER,16768563,19687889,766631188,PORT CITY OPERATING COMPANY LLC,2023-06-30,9196902,68211970,726724303,7571661,0
561509260,1,REX HOSPITAL,23394802,41153619,1618090000,REX HOSPITAL INC,2023-06-30,30925578,36474870,1623015427,-7530776,0
540622371,1,CULPEPER MEMORIAL HOSPITAL,8911825,9026133,155912301,UVA CULPEPER MEDICAL CENTER,2023-06-30,1439448,2287285,146065021,7472377,0
520689917,1,BALTIMORE WASHINGTON MEDICAL CENTER,0,0,447393852,Baltimore Washington Medical Center Inc,2023-06-30,7446698,21330199,469928868,-7446698,0
330420041,1,SAN GORGONIO MEMORIAL,249237,2093516,103355216,SAN GORGONIO MEMORIAL HOSPITAL,2023-06-30,7667490,7880559,102284843,-7418253,0
396105970,1,FROEDTERT MEM. LUTHERAN HOSPT.,18210660,33488341,2400375655,FROEDTERT MEMORIAL LUTHERAN HOSPITAL,2023-06-30,10813677,314430889,2387419901,7396983,0
630578923,1,ST. VINCENTS EAST,16163641,18958408,269589592,St Vincent's East,2023-06-30,8953534,12222245,299490032,7210107,0
540506332,1,CARILION MEDICAL CENTER,8523821,23320229,1701734669,Carilion Medical Center,2023-09-30,15701863,69145638,1769567616,-7178042,0
581581103,1,UNIVERSITY HEALTH SERVICES  INC.,33555755,44603056,783679012,UNIVERSITY HEALTH SERVICES INC,2023-06-30,26512585,46260817,499946431,7043170,0
621113169,1,REGIONAL ONE HEALTH,48756080,64412800,758630686,SHELBY COUNTY HEALTH CARE CORPORATION,2023-06-30,55783004,102367856,729281763,-7026924,0
951802779,1,BAKERSFIELD MEMORIAL HOSPITAL,11752589,14020436,594449805,BAKERSFIELD MEMORIAL HOSPITAL,2023-06-30,4888312,20925929,577225549,6864277,0
860100882,1,VERDE VALLEY MEDICAL CENTER,3328336,5483885,167516657,Verde Valley Medical Center,2023-06-30,10184506,28691619,165031079,-6856170,0
260194016,1,BAYLOR SCOTT & WHITE MC- LAKE POINTE,17257703,24364367,237761842,Lake Pointe Operating Company LLC,2023-06-30,10441483,12100117,226566831,6816220,0
232201344,3,PHOENIXVILLE HOSPITAL,3839585,7511057,520204581,TOWER HEALTH,2023-06-30,10623357,32700784,619770704,-6783772,0
352228583,1,PIEDMONT MOUNTAINSIDE HOSPITAL  INC.,10797650,11802001,122771650,PIEDMONT MOUNTAINSIDE HOSPITAL INC,2023-06-30,4031010,5994329,124952063,6766640,0
