ein,ccn_count,hospital_name,hcris_charity_care_cost,hcris_uncompensated_care_cost,hcris_total_operating_expenses,sched_h_organization_name,sched_h_tax_period_end,sched_h_financial_assistance_at_cost,sched_h_total_community_benefit,sched_h_total_expenses,charity_gap,community_benefit_pct_of_expenses
363488183,1,UNIVERSITY OF CHICAGO HOSPITALS,23228455,28517513,2925815531,University of Chicago Medical Center,2023-06-30,22977739,193252716,2733285491,250716,0
390832914,1,STOUGHTON HOSPITAL ASSOCIATION,450701,884799,57619755,Stoughton Hospital Association,2023-09-30,200000,4391927,57223237,250701,0
263091251,1,DIMMIT REGIONAL HOSPITAL DISTRICT,1864552,2772144,28611420,Dimmit Regional Hospital,2023-09-30,2114376,2879337,37234794,-249824,0
311724085,1,HOLZER MEDICAL CENTER JACKSON,441084,1364348,21834762,HOLZER MEDICAL CENTER - JACKSON,2023-06-30,191579,232704,23655709,249505,0
366000085,2,METHODIST HOSPITAL OF CHICAGO,562463,950734,102098558,THOREK MEMORIAL HOSPITAL,2023-06-30,313328,693584,101482306,249135,0
270847538,1,ASCENSION ST VINCENT SALEM,610576,1154577,19409298,St Vincent Salem Hospital Inc,2023-06-30,361502,3418851,17874169,249074,0
020354549,1,CHESHIRE MEDICAL CENTER,2046013,3683427,310540817,Cheshire Medical Center,2023-06-30,2294856,23389902,287817174,-248843,0
810243720,1,SHERIDAN MEMORIAL HOSPITAL,162795,701454,20976659,SHERIDAN MEMORIAL HOSPITAL ASSOCIATION,2023-06-30,410690,3185053,19114895,-247895,0
392031968,1,CHI HEALTH NEBRASKA HEART,616014,913875,74130850,NEBRASKA HEART HOSPITAL,2023-06-30,373367,1044037,68992180,242647,0
560554222,1,ST LUKES HOSPITAL,483774,2085715,45398836,ST LUKE'S HOSPITAL INC,2023-09-30,242489,3296016,42091076,241285,0
141338467,1,NORTHERN DUTCHESS HOSPITAL,1331203,2035416,179277749,Northern Dutchess Hospital,2023-09-30,1090011,14697797,179395760,241192,0
204474637,1,JANE TODD CRAWFORD HOSPITAL,176731,766680,32236774,JANE TODD CRAWFORD MEMORIAL HOSP,2023-06-30,417917,-18199465,28884967,-241186,-1
370673506,1,GRAHAM HOSPITAL ASSOCIATION,1381952,2922455,130590903,GRAHAM HOSPITAL ASSOCIATION,2023-06-30,1144382,7243776,117810031,237570,0
391140373,1,PRAIRIE RIDGE HEALTH  INC.,590937,1188260,66830133,PRAIRIE RIDGE HEALTH INC,2023-09-30,355000,12576040,68481707,235937,0
351869951,1,ST. VINCENT HEART CENTER,1236315,1863542,130714247,CENTRAL INDIANA HEALTH SYSTEM CARDIAC SERVICES INC,2023-06-30,1001511,4232951,66078765,234804,0
010215227,1,RUMFORD HOSPITAL,79818,1920849,47484551,RUMFORD HOSPITAL,2023-06-30,313716,3661335,52943470,-233898,0
383835105,4,KAPIOLANI MED CTR FOR WOMEN & CHILDR,4656928,7920748,1424425179,Hawai'i Pacific Health Group Return,2023-06-30,4889835,58780912,1521333041,-232907,0
460228038,1,MADISON REGIONAL HEALTH SYSTEM,432912,1364490,34227291,MADISON COMMUNITY HOSPITAL,2023-06-30,203000,2882824,34307837,229912,0
410706143,1,FIRST CARE MEDICAL SERVICES,95045,356147,29911185,FIRST CARE MEDICAL SERVICES,2023-06-30,324011,1642828,30509690,-228966,0
390810545,1,ST. JOSEPHS HOSPITAL,308266,750824,56220488,St Joseph's Hospital of the Hospital Sisters of the Third Order of St Franc,2023-06-30,81463,8626159,48582155,226803,0
811312058,1,THE MEDICAL CENTER OF ALBANY,78414,200960,7614612,THE MEDICAL CENTER AT CLINTON COUNTY INC,2023-03-31,303912,368227,16494027,-225498,0
463433074,1,MERCY HOSPITAL KINGFISHER,291373,795354,16485883,MERCY HOSPITAL KINGFISHER INC,2023-06-30,513906,1392481,15096499,-222533,0
866007596,1,YUMA REGIONAL MEDICAL CENTER,4128244,16057367,715197546,Yuma Regional Medical Center,2023-09-30,4350268,48277316,772968183,-222024,0
631058174,1,CULLMAN REGIONAL,1717128,9417082,193670148,CULLMAN REGIONAL MEDICAL CENTER INC,2023-06-30,1936900,11141538,177312584,-219772,0
421017512,1,UPLAND HILLS HEALTH,320072,667325,84964059,UPLAND HILLS HEALTH INC,2023-09-30,538750,6734516,84323330,-218678,0
383426063,1,CARO COMMUNITY HOSPITAL,254134,342581,18745224,CARO COMMUNITY HOSPITAL,2023-09-30,36539,1921533,19547296,217595,0
263173902,1,MERCY HOSPITAL HEALDTON  INC.,495966,1093833,8920259,MERCY HOSPITAL HEALDTON,2023-06-30,282365,839453,8378267,213601,0
810286525,1,STILLWATER BILLINGS CLINIC,175065,278380,6718825,STILLWATER HOSPITAL ASSOCIATION,2023-06-30,386229,388242,13836535,-211164,0
640926753,1,MARION REGIONAL MEDICAL CENTER,1292789,2146496,23133477,Marion Regional Medical Center Inc,2023-09-30,1082374,1082374,23302301,210415,0
710655753,1,MERCY HOSPITAL PARIS,418067,855847,12114889,MERCY HOSPITAL PARIS,2023-06-30,208887,294833,12541074,209180,0
146019179,1,PUTNAM HOSPITAL CENTER,1182242,2453534,148921848,Putnam Hospital Center,2023-09-30,1386670,15752119,151267027,-204428,0
470399853,1,CHI HEALTH SCHUYLER,778654,1327653,15246059,ALEGENT HEALTH-MEMORIAL HOSPITAL,2023-06-30,574269,1102537,14597326,204385,0
060646966,1,WINDHAM COMMUNITY MEMORIAL HOSPITAL,2026919,3007499,124122454,Windham Community Memorial Hospital Inc,2023-09-30,1823694,16451819,130429245,203225,0
742851819,1,ARTESIA GENERAL HOSPITAL,141435,168455,78812403,ARTESIA GENERAL HOSPITAL,2023-06-30,344508,14651169,73991424,-203073,0
381420304,1,MCLAREN CENTRAL MICHIGAN,1316246,2509945,163309616,MCLAREN CENTRAL MICHIGAN,2023-09-30,1114333,11612791,166322461,201913,0
352112529,1,ASCENSION ST. VINCENT CLAY,528731,1005917,19205737,St Vincent Clay Hospital Inc,2023-06-30,328297,4558544,20364798,200434,0
222537423,1,BAYSTATE NOBLE HOSPITAL,233190,1350657,81064227,BAYSTATE NOBLE HOSPITAL CORPORATION,2023-09-30,432487,7916747,80972738,-199297,0
853033915,1,OWENSBORO HEALTH TWIN LAKES MEDICAL,360889,1967037,53104935,Owensboro Health Twin Lakes Regional Medical Center Inc,2023-05-31,164708,351539,50312873,196181,0
990269825,1,WAHIAWA GENERAL HOSPITAL,0,425618,29130635,WAHIAWA GENERAL HOSPITAL,2023-06-30,195462,1755874,38330427,-195462,0
475437700,1,PIONEER MEDICAL CENTER,100310,296176,13911037,PIONEER MEDICAL CENTER,2023-06-30,295192,301675,12403524,-194882,0
042769210,1,SOUTH SHORE HOSPITAL,3821835,9226467,823354178,SOUTH SHORE HOSPITAL INC,2023-09-30,4015214,64541826,822354818,-193379,0
710766341,1,OUACHITA COUNTY MEDICAL CENTER,249693,1008631,35335990,OUACHITA COUNTY MEDICAL CENTER,2023-09-30,57062,404623,40440456,192631,0
481253246,1,PAWNEE VALLEY COMMUNITY HOSPITAL,77256,560271,19637213,Pawnee Valley Community Hospital Inc,2023-06-30,266745,3153569,19837006,-189489,0
455199762,1,MERCY HOSPITAL WATONGA,425038,858623,8116650,MERCY HOSPITAL WATONGA INC,2023-06-30,235673,785215,8797531,189365,0
410695603,1,ST. JOSEPHS AREA HEALTH SERVICES,522068,1018923,52263027,ST JOSEPH'S AREA HEALTH SERVICES,2023-06-30,333067,3132685,50077928,189001,0
920037099,1,SOUTH PENINSULA HOSPITAL,934253,2839586,134752860,SOUTH PENINSULA HOSPITAL INC,2023-06-30,1122945,21885660,110793354,-188692,0
410695602,1,ST. JOSEPHS MEDICAL CENTER,1015281,2913183,305173969,ST JOSEPH'S MEDICAL CENTER,2023-06-30,1203923,14345334,263747087,-188642,0
810231786,1,FRANCES MAHON DEACONESS HOSPITAL,543982,2082671,56065290,FRANCES MAHON DEACONESS HOSPITAL,2023-06-30,355420,2319759,36295864,188562,0
720652905,1,WOMANS HOSPITAL,6209147,8045378,429882351,WOMAN'S HOSPITAL FOUNDATION,2023-09-30,6397594,44549654,782416209,-188447,0
540568001,1,CARILION ROCKBRIDGE COMMUNITY HOSP,559566,1528322,65562208,Carilion Rockbridge Community Hospital,2023-09-30,747091,3027911,70231833,-187525,0
390807065,1,ASPIRUS STANLEY HOSPITAL,304220,520629,22462972,ASPIRUS STANLEY HOSPITAL & CLINICS INC,2023-06-30,118869,2159216,20764733,185351,0
410853163,1,TYLER HEALTHCARE CENTER,247216,248047,13538030,Avera Tyler,2023-06-30,63320,2286840,12739104,183896,0
222807681,1,JONES MEMORIAL HOSPITAL,576847,1369059,75759646,MEMORIAL HOSPITAL OF WILLIAM F AND,2023-06-30,394633,4951734,74067556,182214,0
450231181,1,JAMESTOWN REGIONAL MEDICAL CENTER,305006,1072089,80373726,Lutheran Charity Association,2023-06-30,487000,2422921,73982858,-181994,0
810247969,1,LOGAN HEALTH WHITEFISH,305244,1520982,63608499,LOGAN HEALTH - WHITEFISH,2023-03-31,485613,4622298,93449642,-180369,0
275401105,1,TWIN CITY HOSPITAL,178784,1069880,26813974,TRINITY HOSPITAL TWIN CITY,2023-06-30,0,4923281,27625269,178784,0
823844150,1,BMH-CRITTENDEN,1884393,2331244,22174320,BAPTIST MEMORIAL HOSPITAL-CRITTENDEN,2023-09-30,2063039,3124115,22174382,-178646,0
920573933,1,CROSSROADS COMMUNITY HOSPITAL,205639,209330,41609324,Deaconess Illinois Crossroads Inc,2023-09-30,28000,10855048,42372338,177639,0
420818642,1,MERCYONE ELKADER MEDICAL CENTER,241282,360663,13027154,CENTRAL COMMUNITY HOSPITAL,2023-06-30,63804,146614,12325449,177478,0
231352156,1,AMERICAN ONCOLOGIC HOSPIAL,0,0,275732222,The American Oncologic Hospital,2023-06-30,177000,57038460,295262904,-177000,0
440537826,1,COMMUNITY HOSPITAL ASSOCIATION  INC.,219683,1337357,25008921,COMMUNITY HOSPITAL ASSOCIATION INC,2023-06-30,44038,518728,25797577,175645,0
320583236,1,MONROE HEALTH SERVICES  INC.,2216929,3805842,44589789,Monroe Health Services Inc,2023-09-30,2042054,2042054,44589787,174875,0
640844470,1,BAPTIST MEDICAL CENTER - YAZOO,1468260,2462146,19155988,BAPTIST MEDICAL CENTER - YAZOO INC,2023-09-30,1642474,3903497,19155987,-174214,0
240798839,1,WAYNE MEMORIAL HOSPITAL,214828,1577418,119508637,WAYNE MEMORIAL HOSPITAL,2023-06-30,389033,8994978,117805445,-174205,0
640655993,1,OCHSNER CHOCTAW GENERAL,564249,1529905,19195559,RUSH HOSPITAL - BUTLER INC,2022-12-31,738251,742431,18156821,-174002,0
237426289,1,HARRISBURG MEDICAL CENTER  INC.,542603,1366210,60409673,Harrisburg Medical Center Inc,2023-03-31,714516,10550138,55977335,-171913,0
480545923,1,CLOUD COUNTY HEALTH CENTER,450370,1072454,27204090,Cloud County Health Center Inc,2023-09-30,280000,5282355,24619785,170370,0
450231675,1,OAKES COMMUNITY HOSPITAL,265573,462579,12407408,OAKES COMMUNITY HOSPITAL,2023-06-30,96123,265172,11716991,169450,0
541489410,1,VCU HEALTH TAPPAHANNOCK HOSPITAL,1193928,2153878,67676670,VCU Health Tappahannock Hospital,2023-06-30,1024548,1024548,67304916,169380,0
341048666,2,CHWC-MONTPELIER,1920145,3039299,119594101,COMMUNITY HOSPITALS & WELLNESS CENTERS,2023-09-30,2089522,8884735,122376813,-169377,0
450227752,1,GARRISON MEMORIAL HOSPITAL,188536,394533,14010364,GARRISON MEMORIAL HOSPITAL,2023-06-30,20140,220737,12299346,168396,0
370792770,1,GREENVILLE REGIONAL HOSPITAL,252157,526972,26045427,HSHS Holy Family Hospital,2023-06-30,85079,5354118,28009557,167078,0
222472997,1,BROCKTON HOSPITAL  INC.,3965446,9017896,317198185,Brockton Hospital Inc,2023-09-30,4131185,52127590,317198182,-165739,0
371396010,1,BCC DBA ILLINI COMMUNITY HOSPITAL,528021,1160078,34533857,BLESSINGCARE CORPORATION,2023-09-30,362625,1668702,34749645,165396,0
481226977,1,GREAT PLAINS OF REPUBLIC CO.  INC,247071,646802,20190263,Great Plains of Republic Co Inc,2023-09-30,82399,1215859,20734472,164672,0
610420440,1,HARRISON MEMORIAL HOSPITAL,706309,1947921,85082352,HARRISON MEMORIAL HOSPITAL INC,2023-09-30,542073,617073,83288502,164236,0
460360899,4,MONUMENT HEALTH LEAD-DEADWOOD HOSPIT,1160748,4265534,205217618,Monument Health Network Inc,2023-06-30,1324557,10259583,200759854,-163809,0
884142509,1,RED BUD REGIONAL HOSPITAL,190611,202870,28163615,Deaconess Illinois Red Bud Regional,2023-09-30,29000,4364744,29121380,161611,0
731008550,2,JEFFERSON COUNTY HOSPITAL,3770356,5342795,182015969,Duncan Regional Hospital Inc,2023-06-30,3609081,24203532,190581862,161275,0
540544705,1,JOHNSTON MEMORIAL HOSPITAL,2330879,3309046,186436633,Johnston Memorial Hospital Inc,2023-06-30,2171294,12499085,175985686,159585,0
390873606,1,HOWARD YOUNG MEDICAL CENTER,384365,718004,39156872,THE HOWARD YOUNG MEDICAL CENTER INC,2023-06-30,225094,4060033,37278756,159271,0
383160564,1,ASCENSION RIVER DISTRICT HOSPITAL,264642,831653,30509147,ASCENSION RIVER DISTRICT HOSPITAL,2023-06-30,106480,1874235,37045561,158162,0
420782518,1,CHI HEALTH MERCY CORNING,267945,494111,23613495,ALEGENT HEALTH-MERCY HOSPITAL CORNING,2023-06-30,110034,1483640,21659636,157911,0
362167785,1,MENDOTA COMMUNITY HOSPITAL,633896,1110777,37256142,Mendota Community Hospital,2023-09-30,477804,3314569,38066650,156092,0
810384618,1,BIG HORN HOSPITAL,188870,1171244,17745461,BIG HORN HOSPITAL ASSOCIATION,2023-06-30,33319,1133657,19934514,155551,0
381459366,1,MUNSON HEALTHCARE CHARLEVOIX HOSPITA,0,106126,73620270,MUNSON HEALTHCARE CHARLEVOIX,2023-06-30,154395,6856465,72864245,-154395,0
990251372,1,MOLOKAI GENERAL HOSPITAL,177198,265183,21473917,MOLOKAI GENERAL HOSPITAL,2023-06-30,331568,334520,47625925,-154370,0
061745397,1,OCONTO HOSPITAL & MEDICAL CENTER,657660,1156515,81698821,OCONTO HOSPITAL AND MEDICAL CENTER,2023-09-30,504277,2960393,84257972,153383,0
621138045,1,BAPTIST MEM HOSPITAL UNION CITY,1872388,2790643,49843507,BAPTIST MEMORIAL HOSPITAL-UNION CITY,2023-09-30,1719350,11661692,49485513,153038,0
042767880,1,MELROSEWAKEFIELD HEALTHCARE  INC,463401,1914464,286456529,MELROSEWAKEFIELD HEALTHCARE INC,2023-09-30,613594,24529552,286401935,-150193,0
411924645,1,LONG PRAIRIE MEMORIAL HOSPITAL,525629,772057,36100012,CENTRACARE HEALTH SYSTEM - LONG PRAIRIE,2023-06-30,378474,1207509,40660224,147155,0
382602147,1,MYMICHIGAN MEDICAL CENTER SAULT,412357,2087639,138956725,MYMICHIGAN MEDICAL CENTER SAULT,2023-06-30,266378,10461865,143218642,145979,0
440629397,1,CARROLL COUNTY HOSPITAL,173609,424158,44554580,CARROLL COUNTY MEMORIAL HOSPITAL,2023-06-30,318380,1141195,40751770,-144771,0
810241755,1,CABINET PEAKS MEDICAL CENTER,411299,1195877,48150374,St John's Lutheran Hospital Inc,2023-03-31,556000,2929573,42297640,-144701,0
810236460,1,MADISON VALLEY MEDICAL CENTER,0,302149,15373893,MADISON VALLEY HOSPITAL INC,2023-09-30,143440,1575403,15924724,-143440,0
453215312,1,KINGS DAUGHTERS MED CENTER OHIO,223380,609161,25780947,PORTSMOUTH HOSPITAL CORPORATION,2023-06-30,83058,201489,20919363,140322,0
020280367,1,ANDROSCOGGIN VALLEY HOSPITAL,566044,3832756,83743498,ANDROSCOGGIN VALLEY HOSPITAL INC,2023-09-30,426201,2518862,87507863,139843,0
610624096,1,CUMBERLAND COUNTY HOSPITAL,93086,580021,27485495,CUMBERLAND COUNTY HOSPITAL ASSOCIATION,2023-06-30,232330,648446,19776676,-139244,0
410713914,1,WINONA HEALTH SERVICES,285503,1554941,137590110,Winona Health Services Inc,2023-09-30,424000,13153676,122219652,-138497,0
030183483,1,RUTLAND REGIONAL MEDICAL CENTER,2619994,4701084,339150236,Rutland Hospital Inc,2023-09-30,2757597,57529048,338672122,-137603,0
043229679,1,BETH ISRAEL DEACONESS HOSPITAL- NEED,846748,1410069,280081798,BETH ISRAEL DEACONESS HOSPITAL - NEEDHAM,2023-09-30,983578,8620710,140022676,-136830,0
390806404,1,VERNON MEMORIAL HOSPITAL,993607,1921372,71883551,VERNON MEMORIAL HEALTHCARE INC,2023-09-30,858093,4543845,82056626,135514,0
920574426,1,UNION COUNTY HOSPITAL DISTRICT,185780,219597,20618474,Deaconess Illinois Union County,2023-09-30,51000,3947164,21791254,134780,0
380350304,1,MUNSON HEALTHCARE MANISTEE HOSPITAL,0,71661,55570436,MUNSON HEALTHCARE MANISTEE,2023-06-30,133638,7312408,61273657,-133638,0
411811073,1,ST MARYS HOSPITAL SUPERIOR,747546,2243144,83817963,ST MARY'S HOSPITAL OF SUPERIOR,2023-06-30,614396,2834218,84139848,133150,0
710835247,1,CROSSRIDGE COMMUNITY HOSPITAL,581674,1199643,19476089,ST BERNARDS COMMUNITY HOSPITAL,2023-09-30,449538,1454084,19124186,132136,0
390808503,1,ASPIRUS MERRILL HOSPITAL,168061,512346,26110919,ASPIRUS MERRILL HOSPITAL & CLINICS INC,2023-06-30,299743,2108793,23542139,-131682,0
440546366,1,CAPITAL REGION MEDICAL CENTER,4331962,4632371,135883676,CAPITAL REGION MEDICAL CENTER,2023-06-30,4463224,19175885,263388160,-131262,0
621816368,1,HAWKINS COUNTY MEMORIAL HOSPITAL,915111,1210419,14585625,Wellmont Hawkins County Memorial,2023-06-30,784074,3144163,15058939,131037,0
460400557,1,DOUGLAS COUNTY MEMORIAL HOSPITAL,16587,433794,12662678,DOUGLAS COUNTY MEMORIAL HOSPITAL,2023-05-31,147189,310449,12073754,-130602,0
810469886,1,DEER LODGE MEDICAL CENTER,168735,474020,24593726,POWELL COUNTY MEMORIAL HOSPITAL ASSOC,2023-06-30,297723,827937,23369558,-128988,0
020226774,1,SPEARE MEMORIAL HOSPITAL,393814,917142,79984603,Speare Memorial Hospital,2023-06-30,265376,7040611,77186933,128438,0
742323822,1,YOAKUM COMMUNITY HOSPITAL,1599833,2333652,24908081,Yoakum Community Hospital,2023-06-30,1473000,1473000,27781282,126833,0
815056290,1,SHARON HOSPITAL,941338,1591309,73698168,Vassar Health Connecticut Inc,2023-09-30,1067352,11030347,73683904,-126014,0
452438973,1,CCH - SAUK CENTRE,252640,400559,41874258,CENTRACARE HEALTH SYSTEM - SAUK CENTRE,2023-06-30,127858,1266164,39986521,124782,0
941502014,1,MEE MEMORIAL HOSPITAL,257925,1225568,68282391,SOUTHERN MONTEREY COUNTY MEMORIAL,2023-09-30,380591,15161596,68303517,-122666,0
930425580,1,GOOD SHEPHERD MEDICAL CENTER,4388608,6502925,190985339,GOOD SHEPHERD HEALTH CARE SYSTEM,2023-06-30,4268935,45016768,168697863,119673,0
383236977,1,ASPIRUS IRON RIVER HOPSITAL & CLINIC,327037,865884,39181852,ASPIRUS IRON RIVER HOSPITAL & CLINICS,2023-06-30,209067,2756424,41025587,117970,0
391568865,1,MOSH,202204,456534,55318695,WHEATON FRANCISCAN HEALTHCARE - SOUTHEAST WISCONSIN INC,2023-06-30,84302,1548681,34463400,117902,0
273311774,1,ST. LUKES MCCALL,856324,2045118,51070144,St Luke's McCall Ltd,2023-09-30,740370,2350438,55160604,115954,0
381443395,1,ASCENSION ST. JOSEPH HOSPITAL,458522,1223666,54419107,ASCENSION ST JOSEPH HOSPITAL,2023-06-30,574220,3051420,56611949,-115698,0
370702309,1,HARDIN COUNTY GENERAL HOSPITAL,300789,642344,15921035,HARDIN COUNTY GENERAL HOSPITAL,2023-03-31,415813,1793927,14893976,-115024,0
452896080,1,BAPTIST MEDICAL CENTER - LEAKE  INC.,991531,1924457,19111181,BAPTIST MEDICAL CENTER - LEAKE INC,2023-09-30,878730,3234237,19110913,112801,0
391834639,2,ORTHOPAEDIC HOSPITAL OF WISCONSIN,128122,310224,82502076,COLUMBIA ST MARY'S INC,2023-06-30,15528,1412957,198377369,112594,0
582257925,1,EVANS MEMORIAL HOSPITAL,261283,720539,19731893,EVANS MEMORIAL HOSPITAL INC,2023-09-30,148886,1392343,19707065,112397,0
350876389,1,ASCENSION ST. VINCENT MERCY,563416,1003485,25396188,ST VINCENT MADISON COUNTY HEALTH SYSTEM INC,2023-06-30,452718,5115491,24039029,110698,0
208756459,1,MACKINAC STRAITS HEALTH SYSTEM  INC,382752,1563253,67274920,MACKINAC STRAITS HEALTH SYSTEM INC,2023-03-31,273089,2304321,64654395,109663,0
470379039,1,YORK GENERAL HOSPITAL INC,185009,951665,59710351,YORK GENERAL HEALTH CARE SERVICES,2023-09-30,294606,5435772,59333818,-109597,0
730662663,1,ST JOHN SAPULPA,900633,1749725,26066801,St John Sapulpa Inc,2023-06-30,1009620,3627630,26363300,-108987,0
843196350,1,UOFL HEALTH-SHELBYVILLE,867046,1670548,42689493,U OF L HEALTH - SHELBYVILLE INC,2023-06-30,975957,5803132,37979925,-108911,0
810530457,1,LOGAN HEALTH  CUTBANK,156402,393171,9011616,LOGAN HEALTH - CUT BANK,2023-03-31,262481,2792122,11794029,-106079,0
770599553,1,DICKENSON COMMUNITY HOSPITAL,147006,306471,11253718,Dickenson Community Hospital Inc,2023-06-30,41977,4364380,10600306,105029,0
330528802,1,CHILDRENS HOSPITAL AT MISSION,0,0,0,CHILDREN'S HOSPITAL AT MISSION,2023-06-30,103365,14739157,105380405,-103365,inf
481020227,1,COMMUNITY HEALTHCARE SYSTEM,135863,834921,39471132,Community HealthCare System Inc,2023-03-31,32694,3884715,37254287,103169,0
410758434,1,LAKEWOOD HEALTH CENTER,196942,456340,21559343,LAKEWOOD HEALTH CENTER,2023-06-30,95485,1421414,19379929,101457,0
201890414,1,FAYETTE COUNTY HOSPITAL,224876,1873450,44300247,HEARTLAND HEALTH SYSTEM INC,2023-06-30,325387,4848516,39898941,-100511,0
813747248,1,SAINT FRANCIS HOSPITAL VINITA,1011330,1642664,23264152,Saint Francis Hospital Vinita Inc,2023-06-30,911505,2467886,24791269,99825,0
386005550,1,HILLSDALE HOSPITAL,457233,2040804,86827548,HILLSDALE COMMUNITY HEALTH CENTER,2023-06-30,358371,9179296,84425894,98862,0
381443361,1,ASPIRUS KEWEENAW HOSPITAL,401057,1055022,74717117,ASPIRUS KEWEENAW HOSPITAL,2023-06-30,304290,5947824,67471667,96767,0
580973772,1,DONALSONVILLE HOSPITAL,1477575,2891907,33422703,DONALSONVILLE HOSPITAL INC,2023-06-30,1380826,1689767,39424783,96749,0
820844453,1,UPMC LITITZ,1310175,2093662,98614218,UPMC Lititz,2023-06-30,1405926,9870574,133457876,-95751,0
930591528,1,LEGACY MOUNT HOOD MEDICAL CENTER,5672207,7950112,215473618,LEGACY MOUNT HOOD MEDICAL CENTER,2023-03-31,5578089,29359325,227262005,94118,0
851433123,1,CONCORD HOSPITAL - FRANKLIN,312299,1566639,25749457,Concord Hospital - Franklin,2023-09-30,405354,3090837,28622927,-93055,0
390910727,1,WAUKESHA MEMORIAL HOSPITAL,869925,4198369,537970302,PROHEALTH WAUKESHA MEMORIAL,2023-09-30,777316,50030182,551613171,92609,0
941294954,1,VALLEY CHILDRENS HOSPITAL,0,0,761809083,VALLEY CHILDREN'S HOSPITAL,2023-09-30,92423,66032561,775757099,-92423,0
550477361,1,BOONE MEMORIAL HOSPITAL,25131,573934,83609768,BOONE MEMORIAL HOSPITAL INC,2023-06-30,117206,1416076,70345825,-92075,0
731547175,1,LAWRENCE MEMORIAL HOSPITAL,401815,1254170,20039152,LAWRENCE MEMORIAL HEALTH FOUNDATION INC,2023-06-30,310000,1028931,19096200,91815,0
640819193,1,WEBSTER HEALTH SERVICES,985286,1609008,23874109,Webster Health Services Inc,2023-09-30,894386,894386,24021022,90900,0
390890676,1,ST CROIX REGIONAL MEDICAL CENTER,112625,249125,63127502,ST CROIX REGIONAL MEDICAL CENTER,2023-06-30,202794,21024509,148791084,-90169,0
341041385,1,SALEM COMMUNITY HOSPITAL,369099,1339487,127278295,SALEM COMMUNITY HOSPITAL,2023-06-30,280917,4134281,117279252,88182,0
562112733,1,THE OUTER BANKS HOSPITAL INC,1957857,6417319,73031628,The Outer Banks Hospital Inc,2023-09-30,1870052,2948396,116906754,87805,0
460345312,1,HURON REGIONAL MEDICAL CENTER,48348,1750293,54048225,HURON REGIONAL MEDICAL CENTER INC,2023-06-30,135819,3843254,51960020,-87471,0
810269223,1,MCCONE COUNTY HEALTH CENTER,87876,214300,5423770,MCCONE COUNTY HEALTH CENTER INC,2023-06-30,752,335481,5132413,87124,0
020222242,1,WEEKS MEDICAL CENTER,277008,1446316,83318048,WEEKS MEDICAL CENTER,2023-09-30,190787,17772469,88104263,86221,0
061705652,1,CASEY COUNTY HOSPITAL,315304,585400,29946135,CASEY COUNTY HOSPITAL DISTRICT,2023-06-30,401156,401156,27693173,-85852,0
421470935,1,MERCYONE - NEWTON MEDICAL CENTER,226968,848306,40642485,MERCY MEDICAL CENTER - NEWTON,2023-06-30,141631,2057662,41812801,85337,0
540794913,1,SMYTH COUNTY COMMUNITY HOSPITAL,762180,1169074,50192048,Smyth County Community Hospital,2023-06-30,677016,1696928,47496954,85164,0
250965579,1,TITUSVILLE AREA HOSPITAL,708817,1627601,55886370,TITUSVILLE AREA HOSPITAL,2023-06-30,623809,5015049,52992803,85008,0
030177161,1,GRACE COTTAGE HOSPITAL,131032,739985,33638016,Carlos G Otis Health Care Center,2023-09-30,215350,3734780,34616276,-84318,0
370661218,1,MARSHALL BROWNING HOSPITAL,47341,1311682,36573669,MARSHALL BROWNING HOSPITAL ASSOCIATION,2023-06-30,130058,6900830,34380002,-82717,0
390806429,1,ASPIRUS LANGLADE HOSPITAL,651709,2018128,99597592,LANGLADE HOSPITAL - HOTEL DIEU OF,2023-06-30,569185,5266988,97629613,82524,0
742842747,1,RUSSELL REGIONAL HOSPITAL,96102,796889,22097798,West Central Kansas Association Inc,2023-07-31,14708,2577654,22542158,81394,0
710276839,1,DELTA MEMORIAL HOSPITAL,171464,1365126,20249990,DELTA MEMORIAL HOSPITAL,2023-06-30,90348,263844,19558104,81116,0
830300467,1,POWELL VALLEY HEALTH CARE,247758,3128939,79361334,POWELL VALLEY HEALTH CARE INC,2023-06-30,167035,6539270,77873461,80723,0
811708177,1,CHRISTUS MF - SULPHUR SPRINGS,8605839,9962200,115076314,Christus Hopkins Health Alliance,2023-06-30,8525262,9595694,113391344,80577,0
390799566,1,TOMAH MEMORIAL HOSPITAL,330537,1370524,78890020,Tomah Memorial Hospital,2023-09-30,250000,6770454,78880270,80537,0
420890973,1,OSCEOLA REGIONAL HEALTH CENTER,98302,329881,15420268,OSCEOLA COMMUNITY HOSPITAL INC,2023-06-30,19000,1239164,13991254,79302,0
770637498,1,MCKENZIE COUNTY HEALTHCARE SYSTEM,67848,3346207,58984527,McKenzie County Healthcare Systems Inc,2023-06-30,147000,11519887,50635613,-79152,0
383330803,1,TRINITY HEALTH GRAND HAVEN HOSPITAL,97508,1238318,51784227,TRINITY HEALTH GRAND HAVEN HOSPITAL,2023-06-30,18767,1581543,53303889,78741,0
382800065,1,HOLLAND HOSPITAL,1651845,4703189,297965813,HOLLAND COMMUNITY HOSPITAL,2023-03-31,1574891,10867283,296828134,76954,0
273970823,1,FIVE RIVERS MEDICAL CENTER,267184,960436,20015471,FIVE RIVERS MEDICAL CENTER INC,2023-09-30,190324,4134080,21565308,76860,0
020276210,1,UPPER CONNECTICUT VALLEY HOSPITAL,278123,1247907,30358213,UPPER CONNECTICUT VALLEY HOSPITAL,2023-09-30,201563,4536634,31378936,76560,0
720500565,1,DESOTO REGIONAL HEALTH SYSTEM,214369,1110479,30843755,Desoto Hospital Association Inc,2023-09-30,137956,137956,33499116,76413,0
460380552,1,MARSHALL COUNTY HEALTHCARE CENTER,112366,495983,12489761,MARSHALL COUNTY HEALTHCARE CENTER,2023-06-30,36000,2018581,11812829,76366,0
843689003,1,MAYO REGIONAL HOSPITAL,247582,2354007,61019082,MRH Corp,2023-09-30,172903,307881,61056425,74679,0
390794174,1,OCONOMOWOC MEMORIAL HOSPITAL,172088,968742,125890546,PROHEALTH OCONOMOWOC MEMORIAL,2023-09-30,97552,9507863,128919712,74536,0
586025393,1,UNION GENERAL HOSPITAL,874910,2531632,114343760,UNION COUNTY HOSPITAL AUTHORITY,2023-04-30,948225,970451,107433777,-73315,0
640668465,1,CLAY COUNTY MEDICAL CORPORATION,1541251,2834575,46676600,Clay County Medical Corporation,2023-09-30,1468121,1468121,46906177,73130,0
742044647,1,NATIONAL JEWISH HEALTH,5660,1169127,397662000,NATIONAL JEWISH HEALTH,2023-06-30,78522,37233431,370065540,-72862,0
010234189,1,NORTHERN MAINE MEDICAL CENTER,1331,523445,70981960,Northern Maine Medical Center,2023-09-30,74030,3851154,72165102,-72699,0
030179437,1,SPRINGFIELD HOSPITAL,236871,2007569,60065256,Springfield Hospital Inc,2023-09-30,309308,6067904,60539949,-72437,0
391091432,1,REEDSBURG AREA MEDICAL CENTER,973469,1507659,98729861,REEDSBURG AREA MEDICAL CENTER,2023-09-30,901837,8300884,100761358,71632,0
390985690,1,ASPIRUS EAGLE RIVER HOSPITAL,164496,413685,16649467,ASPIRUS EAGLE RIVER,2023-06-30,93752,1159638,16489996,70744,0
237013497,1,MEMORIAL MEDICAL CENTER  INC.,730114,1880048,140199524,MEMORIAL MEDICAL CENTER INC,2023-09-30,659770,11600033,142405477,70344,0
261938641,1,NORTH CANYON MEDICAL CENTER,205574,1011326,58833704,NORTH CANYON MEDICAL CENTER INC,2023-09-30,136778,2802926,58860243,68796,0
274433830,1,MERCY HOSPITAL TISHOMINGO,113652,579589,9671353,MERCY HOSPITAL TISHOMINGO,2023-06-30,182157,530739,9551270,-68505,0
