ein,ccn_count,hospital_name,hcris_charity_care_cost,hcris_uncompensated_care_cost,hcris_total_operating_expenses,hcris_fy_end_dt,svi_overall_pct,svi_socio_pct,svi_household_pct,svi_minority_pct,svi_housing_pct,sched_h_organization_name,sched_h_tax_period_end,sched_h_financial_assistance_at_cost,sched_h_total_community_benefit,sched_h_total_expenses,charity_gap,community_benefit_pct_of_expenses
370661244,1,ST MARYS HOSPITAL,1281936,2367413,151198882,2024-06-30,54,40,51,61,68,St Mary's Hospital Decatur of the Hospital Sisters of the Third Order of St,2023-06-30,225670,24460856,193199982,1056266,0
610654587,1,BAPTIST HEALTH DEACONESSMADISONVILLE,3275618,4642249,255289778,2024-08-31,63,56,80,36,62,Baptist Health Deaconess,2023-08-31,4329392,22971466,235716737,-1053774,0
042103565,1,EMERSON HOSPITAL,2571967,5056407,367287019,2023-09-30,29,12,6,69,83,EMERSON HOSPITAL,2023-09-30,3623855,10406617,367286794,-1051888,0
362167847,1,JAVON BEA HOSPITAL,2823895,6275299,377466274,2024-06-30,77,75,86,71,52,Javon Bea Hospital,2023-06-30,1774854,30963357,388682277,1049041,0
352007327,1,ST. MARY MEDICAL CENTER  INC.,1949965,3865654,306512924,2024-06-30,70,63,78,85,47,St Mary Medical Center Inc,2023-06-30,906226,22259943,324482992,1043739,0
611663540,1,ST. CLAIR MEMORIAL HOSPITAL,4408465,6178237,410313781,2024-06-30,31,20,22,58,60,St Clair Health Corporation Group Return,2023-06-30,3365958,33579083,457268062,1042507,0
951643373,1,COMMUNITY HOSPITAL OF SAN BERNARDINO,8557593,10008060,317435626,2023-12-31,89,89,76,97,75,COMMUNITY HOSPITAL OF SAN BERNARDINO,2023-06-30,7520746,14911277,304447661,1036847,0
440584290,1,COX MEDICAL CENTER BRANSON,5005801,7905698,237781045,2023-09-30,79,79,60,38,91,SKAGGS COMMUNITY HOSPITAL ASSOCIATION,2023-09-30,6036349,11586721,237735325,-1030548,0
710230218,1,ARKANSAS METHODIST MEDICAL CENTER,1342301,3980440,77574532,2024-06-30,69,79,69,27,57,ARKANSAS METHODIST HOSPITAL CORPORATION,2023-06-30,315546,2404286,87707802,1026755,0
470379836,1,CHI HEALTH ST. ELIZABETH,4775415,6629173,191874397,2024-06-30,40,28,29,54,66,SAINT ELIZABETH REGIONAL MEDICAL CENTER,2023-06-30,3751148,16933313,185997105,1024267,0
860098923,1,YAVAPAI REGIONAL MEDICAL CENTER,6323725,10129694,447309217,2023-12-31,60,58,55,55,60,YAVAPAI COMMUNITY HOSPITAL ASSOCIATION,2023-06-30,5308401,28397862,479180916,1015324,0
160743979,1,NICHOLAS H. NOYES MEMORIAL HOSPITAL,462140,1141538,88758991,2024-06-30,23,25,5,30,63,NICHOLAS H NOYES MEMORIAL HOSPITAL,2023-06-30,1471775,11207441,82104471,-1009635,0
930505325,1,GRANDE RONDE HOSPITAL,2159338,2400901,154869412,2024-04-30,72,58,53,37,95,GRANDE RONDE HOSPITAL INC,2023-04-30,1155170,5007374,140230689,1004168,0
231360851,1,UPMC HANOVER,2587502,3976285,174111232,2024-06-30,34,26,50,51,36,UPMC HANOVER,2023-06-30,1584246,11791523,196035366,1003256,0
351738708,1,ST. CATHERINE HOSPITAL,2389659,3763487,173568896,2024-06-30,70,63,78,85,47,St Catherine Hospital Inc,2023-06-30,1386434,12853964,168725272,1003225,0
042103586,1,LAWRENCE GENERAL HOSPITAL,4736387,9998576,345497000,2023-09-30,61,39,56,70,80,Lawrence General Hospital,2023-09-30,3742715,16453187,345497323,993672,0
520591607,1,GOOD SAMARITAN HOSPITAL,7011455,9778034,285851467,2024-06-30,86,81,62,97,85,THE GOOD SAMARITAN HOSPITAL OF,2023-06-30,8002476,23252360,286692766,-991021,0
820912090,1,MEMORIAL HOSPITAL,2892789,4316319,168064172,2024-06-30,34,26,50,51,36,UPMC Memorial,2023-06-30,1903263,12088697,194486243,989526,0
237339737,1,LAKE REGIONAL HEALTH SYSTEM,5914974,8133585,250805867,2024-04-30,35,54,29,16,29,LAKE REGIONAL HEALTH SYSTEM,2023-04-30,4948568,11294041,235972558,966406,0
010372148,1,THE AROOSTOOK MEDICAL CENTER,1059687,3315664,170722106,2023-09-30,65,64,68,14,77,THE AROOSTOOK MEDICAL CENTER,2023-09-30,93624,7292223,170663657,966063,0
570341194,1,GEORGETOWN MEMORIAL HOSPITAL,4473366,8979844,189667535,2023-09-30,53,59,35,72,42,GEORGETOWN MEMORIAL HOSPITAL,2023-09-30,3510707,8780216,203101052,962659,0
480559088,1,HAYS MEDICAL CENTER  INC.,819970,2530422,259631156,2024-06-30,24,36,3,34,50,Hays Medical Center Inc,2023-06-30,1774551,44513044,241789820,-954581,0
251244202,1,WINDBER HOSPITAL  INC.,29944,613231,64354869,2024-06-30,36,35,26,11,67,WINDBER HOSPITAL INC,2023-06-30,979320,4704330,60253072,-949376,0
390806302,1,ST. JOSEPHS COMM. HOSPT.,1355597,2734380,154493265,2024-06-30,1,2,3,23,4,ST JOSEPH'S COMMUNITY HOSPITAL OF,2023-06-30,415323,11527805,149344437,940274,0
812946322,1,UCF LAKE NONA HOSPITAL,6103266,6540440,91832015,2024-01-31,80,80,38,93,79,UCF ACADEMIC HEALTH INC,2023-06-30,5167457,13221735,1733999,935809,0
020223321,1,COTTAGE HOSPITAL,1020677,2048719,42193872,2023-09-30,26,21,8,33,70,Cottage Hospital,2023-09-30,88484,2518111,42171933,932193,0
472219204,1,MERCY HOSPITAL LINCOLN,2232123,3878218,48302500,2024-06-30,20,23,42,19,19,MERCY HOSPITAL LINCOLN,2023-06-30,1300838,5267748,45305166,931285,0
590791028,1,HOLY CROSS HOSPITAL,7349232,11716145,633839356,2024-06-30,78,79,49,95,68,HOLY CROSS HOSPITAL INC,2023-06-30,8278178,31312827,616268968,-928946,0
331007002,2,KENMARE COMMUNITY HOSPITAL,2407627,9121910,525278443,2024-06-30,26,15,7,51,76,TRINITY HEALTH & AFFILIATES,2023-06-30,3333435,6677571,340961681,-925808,0
941156276,2,CLOVIS COMMUNITY MEDICAL CENTER,16262863,22173226,2396009263,2024-08-31,96,94,88,97,88,FRESNO COMMUNITY HOSPITAL,2023-08-31,17175000,168515953,2349133160,-912137,0
382146751,1,MCLAREN NORTHERN MICHIGAN,2789040,5072996,235921955,2023-09-30,11,14,7,31,30,MCLAREN NORTHERN MICHIGAN,2023-09-30,1884145,16368121,248825832,904895,0
464249555,1,GOUVERNEUR HOSPITAL,902381,1117970,29611490,2023-12-31,71,67,29,23,98,GOUVERNEUR HOSPITAL,2022-12-31,0,4427448,29588845,902381,0
861248931,1,ST LUKES HOSPITAL-CARBON CAMPUS,1465336,1957367,89285309,2024-06-30,29,53,21,30,18,ST LUKE'S HOSPITAL - CARBON CAMPUS,2023-06-30,564556,12587786,85432328,900780,0
951643336,1,USC ARCADIA HOSPITAL,2632852,4177806,370526566,2023-12-31,86,90,28,97,92,USC ARCADIA HOSPITAL,2023-06-30,1734325,47845957,346498633,898527,0
941156295,1,SAINT FRANCIS MEMORIAL HOSPITAL,8870544,10261092,344436338,2023-12-31,48,29,3,93,96,SAINT FRANCIS MEMORIAL HOSPITAL,2023-06-30,9766090,59395524,268431453,-895546,0
420680370,1,AVERA HOLY FAMILY HEALTH,1056902,1061905,29849700,2024-06-30,25,19,63,47,18,Avera Holy Family,2023-06-30,163757,5534444,26647358,893145,0
420796764,1,SIOUX CENTER HEALTH,1392260,2136412,70863009,2024-06-30,13,5,26,41,35,Sioux Center Health,2023-06-30,500000,8309992,62747832,892260,0
561844262,1,MURPHY MEDICAL CENTER,2436452,3828425,67923894,2024-06-30,37,72,25,29,13,MURPHY MEDICAL CENTER INC,2023-06-30,1548716,2166713,68916772,887736,0
342032340,1,DILEY RIDGE MEDICAL CENTER,1041492,1658124,15186631,2024-06-30,20,16,45,47,18,DILEY RIDGE MEDICAL CENTER,2023-06-30,160008,869464,19191249,881484,0
820880337,1,UPMC CARLISLE,2242389,3151584,128231470,2024-06-30,21,12,15,47,53,UPMC Carlisle,2023-06-30,1362910,11787693,157859839,879479,0
231352220,1,THE GETTYSBURG HOSPITAL,2365577,4658864,296183102,2024-06-30,21,21,31,35,25,GETTYSBURG HOSPITAL,2023-06-30,1494273,21416146,289693384,871304,0
381359247,1,ASCENSION PROVIDENCE ROCHESTER HOSPI,1397574,4015925,270630604,2024-06-30,14,13,12,67,21,ASCENSION PROVIDENCE ROCHESTER HOSPITAL,2023-06-30,526304,12218714,260778832,871270,0
364015560,1,LOYOLA UNIVERSITY MEDICAL CENTER,18723045,21043859,1596272873,2024-06-30,80,78,39,91,83,LOYOLA UNIVERSITY MEDICAL CENTER,2023-06-30,19589854,133448825,1624698168,-866809,0
160393490,1,CORNING HOSPITAL,427763,1882611,171855019,2024-06-30,47,43,44,19,68,CORNING HOSPITAL,2023-06-30,1291694,16153366,160998254,-863931,0
640772726,1,BAPTIST MEM HOSPITAL NORTH MISS,10329380,14087556,220476822,2023-09-30,44,57,1,67,86,BAPTIST MEMORIAL HOSPITAL-,2023-09-30,9468723,14840971,230650477,860657,0
231352174,1,DOYLESTOWN HOSPITAL,538206,2741113,359520323,2024-06-30,13,10,21,50,21,DOYLESTOWN HOSPITAL,2023-06-30,1397655,31597626,348275254,-859449,0
390818682,1,ST. MARYS HOSPITAL MEDICAL CENTER,1073196,1723990,139170690,2024-06-30,30,15,41,54,54,St Mary's Hospital Medical Center of Green Bay Inc - Hospital Sisters,2023-06-30,225625,12816209,133483030,847571,0
310650283,1,MCCULLOUGH-HYDE MEMORIAL HOSPITAL,845783,1756451,50815203,2024-06-30,43,36,51,56,43,MCCULLOUGH-HYDE MEMORIAL HOSPITAL,2023-06-30,0,4620164,47421233,845783,0
581911751,2,SGHS - BRUNSWICK CAMPUS,14986313,35003404,401249893,2024-04-30,72,65,67,71,68,SOUTHEAST GEORGIA HEALTH SYSTEM INC,2023-04-30,15830903,23352501,412118561,-844590,0
930386793,1,LEGACY GOOD SAMARITAN HOSPITAL,6461650,9897753,467234532,2024-03-31,59,50,10,70,93,LEGACY GOOD SAMARITAN HOSPITAL AND,2023-03-31,5617532,45623073,480713407,844118,0
460543230,1,THE WESTERLY HOSPITAL,1421934,2735562,146000492,2023-09-30,13,16,12,29,26,LMW HEALTHCARE INC,2023-09-30,578110,12535219,145612405,843824,0
271789847,1,SAINT ALPHONSUS MEDICAL CENTER - ONT,1634440,2091275,77335737,2024-06-30,99,94,95,79,99,SAINT ALPHONSUS MEDICAL CENTER -,2023-06-30,803041,5476357,79799895,831399,0
381358172,1,UM HEALTH-SPARROW CLINTON HOSPITAL,1109052,1791100,85214104,2024-06-30,4,6,11,34,8,SPARROW CLINTON HOSPITAL,2023-06-30,279769,1078917,26333312,829283,0
550675666,1,CABELL HUNTINGTON HOSPITAL,1533988,11661664,746466819,2023-09-30,73,78,39,31,86,CABELL HUNTINGTON HOSPITAL INC,2023-09-30,705490,169868469,800132520,828498,0
060250773,1,THE WILLIAM W. BACKUS HOSPITAL,5327560,8513172,472761335,2023-09-30,,,,,,The William W Backus Hospital,2023-09-30,4506421,48902548,518395676,821139,0
382689033,1,MCLAREN LAPEER REGION,2028091,3393446,129172427,2023-09-30,21,25,26,27,26,MCLAREN LAPEER REGION,2023-09-30,1208850,5321477,138584118,819241,0
832550272,1,ST. VINCENTS MEDICAL CENTER,11141725,15388342,607953199,2023-09-30,,,,,,SVMC Holdings Inc,2023-09-30,11960872,66689726,637943962,-819147,0
593650609,1,ASCENSION ST. VINCENTS ST. JOHNS COU,2033973,2970562,70440738,2024-06-30,13,17,19,53,10,St Vincent's Health System Inc,2023-06-30,1217493,3373376,136902071,816480,0
250965274,1,BUTLER MEMORIAL HOSPITAL,1991822,3751103,283634181,2024-06-30,8,7,4,12,47,BUTLER HEALTHCARE PROVIDERS,2023-06-30,1180575,13447655,361808591,811247,0
141338471,1,CHAMPLAIN VALLEY PHYSICIANS HOSPITAL,1859241,6104182,456517604,2023-09-30,44,38,8,30,91,CHAMPLAIN VALLEY PHYSICIANS HOSPITAL,2023-09-30,1048373,52632243,458412148,810868,0
042103602,1,MILFORD REGIONAL MEDICAL CENTER  INC,1985648,5952978,294602016,2023-09-30,51,34,41,63,74,MILFORD REGIONAL MEDICAL CENTER INC,2023-09-30,2795946,30030390,294602019,-810298,0
431936699,1,MERCY HOSPITAL CASSVILLE,1368482,2252454,20599127,2024-06-30,58,67,75,51,26,Mercy Hospital Cassville,2023-06-30,565731,574601,21177584,802751,0
141347719,1,ST. MARYS HEALTHCARE,1672568,3862801,188945929,2024-06-30,79,69,89,55,72,ST MARY'S HEALTHCARE,2023-06-30,870436,25569911,185684320,802132,0
470379755,1,CHI HEALTH GOOD SAMARITAN,3563111,6091901,186536607,2024-06-30,38,29,41,42,54,GOOD SAMARITAN HOSPITAL,2023-06-30,2780825,11749020,176723845,782286,0
351142669,1,ST. JOSEPHS REG MED CENTER PLYMOUTH,1388426,1961073,53033469,2024-06-30,45,46,46,39,45,SAINT JOSEPH REGIONAL MEDICAL,2023-06-30,607377,5713394,61283305,781049,0
431240629,1,FREEMAN NEOSHO HOSPITAL,1877182,2772175,31894213,2024-03-31,57,56,44,49,64,FREEMAN NEOSHO HOSPITAL,2023-03-31,1101279,2101279,31855733,775903,0
020222791,1,ALICE PECK DAY MEMORIAL HOSPITAL,137532,1391520,104234628,2024-06-30,26,21,8,33,70,Alice Peck Day Memorial Hospital,2023-06-30,906528,6083474,95559929,-768996,0
560603898,1,HARNETT HEALTH SYSTEM,7426808,9632717,129542073,2023-09-30,74,74,81,78,43,HARNETT HEALTH SYSTEM INC,2023-09-30,8195060,24155323,129542076,-768252,0
060646755,1,CONNECTICUT CHILDRENS MEDICAL CENTER,0,0,502193587,2023-09-30,,,,,,CONNECTICUT CHILDREN'S MEDICAL CENTER,2023-09-30,766066,140561689,502193587,-766066,0
237246265,1,SAINT FRANCIS MEDICAL CENTER,18318930,20237429,583057648,2024-06-30,31,36,6,44,61,SAINT FRANCIS MEDICAL CENTER,2023-06-30,17555007,27063193,609570658,763923,0
611345363,1,FLAGET MEMORIAL HOSPITAL,908593,2052272,90076363,2024-06-30,9,14,35,29,5,FLAGET HEALTHCARE INC,2023-06-30,1672219,2756705,84983233,-763626,0
201244058,1,FERRELL HOSPITAL,763384,2062373,58884734,2024-03-31,66,59,74,21,75,FERRELL HOSPITAL COMMUNITY FOUNDATION,2023-03-31,0,4016646,47649963,763384,0
730977997,1,ADAIR COUNTY  HEALTH CENTER,24249,752741,16654156,2024-06-30,95,93,90,93,80,ADAIR COUNTY HEALTH CENTER INC,2023-06-30,783108,4498076,29381431,-758859,0
840398876,1,YAMPA VALLEY MEDICAL CENTER,789255,1072553,31328058,2023-09-30,13,20,4,46,26,YAMPA VALLEY MEDICAL CENTER,2023-06-30,1547573,8484961,132006671,-758318,0
050258914,1,NEWPORT HOSPITAL,1779560,3112544,138342000,2023-09-30,28,22,19,45,54,Newport Hospital,2023-09-30,1022873,10145517,143736247,756687,0
381303843,1,OTSEGO MEMORIAL HOSPITAL,0,96059,120213576,2024-06-30,28,33,57,10,23,MUNSON HEALTHCARE OTSEGO MEMORIAL,2023-06-30,756470,6513052,117451869,-756470,0
381437919,1,MYMICHIGAN MEDICAL CENTER-GRATIOT,2820618,3909462,151089539,2024-06-30,42,35,18,44,73,MYMICHIGAN MEDICAL CENTER ALMA,2023-06-30,2077799,7489139,159426759,742819,0
250965404,1,INDIANA REGIONAL MEDICAL CENTER,2583599,3869567,213007376,2024-06-30,45,52,9,19,82,INDIANA REGIONAL MEDICAL CENTER,2023-06-30,1844212,25857736,202771331,739387,0
390806315,1,ASCENSION COLUMBIA ST MARYS MILWAUKE,7097389,12727424,627896332,2024-06-30,83,69,76,87,84,COLUMBIA ST MARY'S HOSPITAL MILWAUKEE INC,2023-06-30,6365141,76452720,984564500,732248,0
386020434,1,MYMICHIGAN MEDICAL CENTER GLADWIN,1572975,2184509,46218216,2024-06-30,52,71,43,8,47,MYMICHIGAN MEDICAL CENTER GLADWIN,2023-06-30,841147,2451275,44232925,731828,0
680127677,1,MARK TWAIN MEDICAL CENTER,1415350,3566396,81136802,2023-12-31,34,54,47,55,6,MARK TWAIN MEDICAL CENTER,2023-06-30,688230,4924063,80651389,727120,0
824757260,1,CHELSEA HOSPITAL,1220206,2004266,201859705,2024-06-30,32,26,2,68,81,ST JOSEPH MERCY CHELSEA INC,2023-06-30,497349,6533471,193829833,722857,0
952821104,1,HENRY MAYO NEWHALL MEMORIAL HOSPITAL,349001,5679248,403951753,2023-09-30,86,90,28,97,92,HENRY MAYO NEWHALL MEMORIAL HOSPITAL,2023-09-30,1069025,18567677,449367667,-720024,0
222667354,1,BETH ISRAEL DEACONESS - PLYMOUTH,671868,4841406,365074412,2023-09-30,31,20,36,56,47,BETH ISRAEL DEACONESS HOSPITAL-PLYMOUTH,2023-09-30,1386129,29335395,365010307,-714261,0
371705906,1,LLUMC MURRIETA,2384432,4416250,342443165,2024-06-30,82,79,67,95,68,LOMA LINDA UNIVERSITY MED CNTR-MURRIETA,2023-06-30,1670857,22334391,330909553,713575,0
730606129,1,JANE PHILLIPS MEDICAL CENTER,3524803,5222062,135139895,2024-06-30,59,53,91,65,24,Jane Phillips Memorial Medical Center Inc,2023-06-30,2812667,10435086,129538483,712136,0
344429514,1,VAN WERT COUNTY HOSPITAL,850305,1777631,62255795,2023-12-31,4,6,40,18,3,Van Wert County Hospital Association,2022-12-31,147686,5259111,84213342,702619,0
390816848,2,MERCY WALWORTH HOSPITAL,2274763,5100575,1237430507,2024-06-30,25,21,34,48,34,Mercy Health System Corporation,2023-06-30,1574815,49267298,626620672,699948,0
710759299,1,MERCY HOSPITAL BERRYVILLE,1442188,2240138,18242760,2024-06-30,64,66,66,63,47,MERCY HOSPITAL BERRYVILLE,2023-06-30,744185,1563858,20942964,698003,0
042103612,1,NEW ENGLAND BAPTIST HOSPITAL,574235,1174197,242973629,2023-09-30,78,69,20,90,98,NEW ENGLAND BAPTIST HOSPITAL,2023-09-30,1270164,10395533,241317022,-695929,0
381490180,1,UM HEALTH-SPARROW CARSON,981289,1651264,77479357,2024-06-30,46,47,18,34,73,SPARROW CARSON HOSPITAL,2023-06-30,291554,2212082,24961794,689735,0
860334996,1,COPPER QUEEN COMM. HOSP.,923597,2228424,66275166,2024-06-30,93,71,96,85,97,BISBEE HOSPITAL ASSOCIATION INC,2023-06-30,234588,7728378,62988785,689009,0
460877261,1,ASCENSION ST. VINCENT ANDERSON,3469650,5205419,190963818,2024-06-30,60,56,66,46,57,ST VINCENT ANDERSON REGIONAL HOSPITAL INC,2023-06-30,2783683,3412171,185032634,685967,0
150532079,1,GUTHRIE CORTLAND MEDICAL CENTER,366571,1391558,125139566,2024-06-30,37,42,3,26,84,GUTHRIE CORTLAND MEDICAL CENTER,2023-06-30,1051844,15214757,121765073,-685273,0
350877575,1,DEACONESS GIBSON,1147946,1275579,42715315,2023-09-30,23,10,35,25,62,GIBSON GENERAL HOSPITAL,2023-09-30,469335,3173666,42719920,678611,0
383833117,1,ST. JOHN BROKEN ARROW,2869444,3786716,80806218,2024-06-30,78,75,79,79,60,St John Broken Arrow Inc,2023-06-30,2193134,5198506,63139624,676310,0
020222118,1,VALLEY REGIONAL HOSPITAL,1179836,2633271,61892909,2023-09-30,22,38,7,15,39,Valley Regional Hospital Inc,2023-09-30,1856098,6089173,62050272,-676262,0
460726303,1,MEDSTAR SOUTHERN MARYLAND HOSPITAL C,7926633,12721220,320167081,2024-06-30,82,72,51,99,87,MEDSTAR SOUTHERN MD HOSPITAL CENTER INC,2023-06-30,8599166,26075485,307154942,-672533,0
610605336,1,ST. CLAIRE MEDICAL CENTER,489924,2463571,257878250,2024-06-30,51,69,1,9,96,ST CLAIRE MEDICAL CENTER INC,2023-06-30,1162148,5425014,221482866,-672224,0
030181058,1,PORTER HOSPITAL,1438736,6024862,110724361,2023-09-30,14,15,7,23,45,PORTER HOSPITAL INC,2023-09-30,769508,12919009,110741646,669228,0
260335902,1,ST. LUKES LAKESIDE HOSPITAL,946634,1386317,40718213,2024-06-30,52,45,43,76,54,ST LUKE'S COMMUNITY DEVELOPMENT,2023-06-30,279480,711196,0,667154,0
440580870,1,NORTHWEST MEDICAL CENTER,792766,1036066,25147593,2024-06-30,41,57,24,6,51,Northwest Medical Center Association Inc,2023-06-30,1455729,3117994,25713236,-662963,0
540895648,1,BUCHANAN GENERAL HOSPITAL,48675,398254,30198983,2024-06-30,60,85,50,2,44,BUCHANAN GENERAL HOSPITAL,2023-06-30,711401,4046292,32325504,-662726,0
370661202,1,FAIRFIELD MEMORIAL HOSPITAL,243865,2148573,53899269,2024-06-30,48,48,65,2,58,FAIRFIELD MEMORIAL HOSPITAL ASSOCIATION,2023-06-30,905825,6060891,52092469,-661960,0
141338386,1,SUNNYVIEW HOSPITAL AND REHABILITATIO,715341,860929,67010684,2024-06-30,49,40,17,66,74,SUNNYVIEW HOSPITAL AND REHABILITATION,2023-06-30,54699,4909608,64400582,660642,0
582224545,1,BACON COUNTY HOSPITAL,707728,3100815,50850237,2024-06-30,89,74,98,63,85,BACON COUNTY HEALTH SERVICES INC,2023-06-30,48325,1827933,47504934,659403,0
910715805,1,ENUMCLAW REGIONAL HOSPITAL DBA SEH,1470321,2055028,62342926,2024-06-30,38,19,5,82,88,ENUMCLAW REGIONAL HOSPITAL ASSOCIATION,2023-06-30,811338,2152626,66588120,658983,0
750755367,1,CHI ST LUKES HEALTH MEMORIAL LUFKIN,7831949,10756282,186801377,2024-06-30,99,94,99,79,97,MEMORIAL HEALTH SYSTEM OF EAST TEXAS,2023-06-30,7173470,11180489,175786573,658479,0
350869066,1,ASCENSION ST. VINCENT HOSPITAL,17124553,26588323,1418422928,2024-06-30,83,81,78,86,63,ST VINCENT HOSPITAL AND HEALTH CARE CENTER INC,2023-06-30,17781486,140884154,1344839298,-656933,0
344428232,1,ST. LUKES HOSPITAL,1089864,2596581,110897542,2023-05-08,68,65,63,70,58,ST LUKE'S HOSPITAL,2023-09-30,433503,18754833,153981351,656361,0
230596940,1,ARIA HEALTH,6615752,9800247,652773808,2024-06-30,95,91,84,95,92,JEFFERSON HEALTH - NORTHEAST,2023-06-30,7270280,93668177,654563468,-654528,0
060647014,1,THE GRIFFIN HOSPITAL,1590593,1944077,239628665,2023-09-30,,,,,,GRIFFIN HOSPITAL,2023-09-30,2241625,24811086,243747183,-651032,0
941450151,1,MARSHALL HOSPITAL,1534838,3138039,316455247,2023-10-31,19,18,20,60,22,MARSHALL MEDICAL CENTER,2023-10-31,2178845,25421988,322191120,-644007,0
344477047,1,HENRY COUNTY HOSPITAL (CAH),642220,1415058,35183615,2023-10-31,10,13,31,34,7,HENRY COUNTY HOSPITAL INC,2023-10-31,0,1994384,35183615,642220,0
640303091,1,ST. DOMINIC-JACKSON MEMORIAL HOSP,14149495,21234957,552368715,2023-12-31,92,94,57,98,86,ST DOMINIC - JACKSON MEMORIAL HOSPITAL,2023-06-30,13512300,16822171,637210113,637195,0
590657322,2,GULF BREEZE HOSPITAL,32944629,38610339,671115960,2023-09-30,58,56,42,64,66,Baptist Health Care Inc,2023-09-30,32308096,73693937,820069902,636533,0
050258896,1,KENT COUNTY MEMORIAL HOSPITAL,2167094,5719728,456111780,2023-09-30,21,24,18,42,29,KENT COUNTY MEMORIAL HOSPITAL,2023-09-30,1530772,47369115,668151722,636322,0
593256803,1,ADVENTHEALTH DELAND,9867430,11556206,207883410,2023-12-31,70,60,69,68,69,MEMORIAL HOSPITAL - WEST VOLUSIA INC,2022-12-31,10503239,24968172,192030772,-635809,0
460224604,2,AVERA WESKOTA MEMORIAL MEDICAL CENTE,452393,453749,12151788,2024-06-30,15,6,18,24,57,Avera Queen of Peace,2023-06-30,1086352,3289517,129039907,-633959,0
042104434,1,WINCHESTER HOSPITAL,2551715,5756895,343793047,2023-09-30,29,12,6,69,83,WINCHESTER HOSPITAL,2023-09-30,3185464,24338137,343339597,-633749,0
743107055,1,ASCENSION ST. VINCENT CARMEL,1909101,3079753,183585865,2024-06-30,3,1,27,51,3,St Vincent Carmel Hospital Inc,2023-06-30,1279260,16406631,165415886,629841,0
410730602,1,LAKE REGION HEALTHCARE,1143882,2284327,161948870,2023-09-30,33,25,49,24,52,LAKE REGION HEALTHCARE CORPORATION,2023-09-30,515000,8650334,161649037,628882,0
850106941,1,ST. VINCENT HOSPITAL,10797383,12302678,580509930,2024-06-30,76,65,69,91,71,St Vincent Hospital,2023-06-30,10169466,26520265,553956987,627917,0
271965272,1,VIA CHRISTI HOSP. WICHITA ST. TERESA,2386072,3018592,51271125,2024-07-31,73,66,81,71,56,ASCENSION VIA CHRISTI HOSPITAL ST TERESA INC,2023-06-30,1759425,1831928,45418176,626647,0
710644637,1,HOWARD MEMORIAL HOSPITAL,897982,1347909,31169206,2023-09-30,88,83,99,75,44,HOWARD MEMORIAL HOSPITAL,2023-09-30,273039,329182,31246292,624943,0
050258954,1,RHODE ISLAND HOSPITAL,20946380,33526955,1896029560,2023-09-30,81,68,59,80,92,Rhode Island Hospital,2023-09-30,20326208,215613813,1953672170,620172,0
362183812,1,OAK PARK HOSPITAL,3954105,5486225,197653080,2024-06-30,80,78,39,91,83,Rush Oak Park Hospital Inc,2023-06-30,3340283,23065471,188436826,613822,0
363332852,1,MACNEAL HOSPITAL,8486831,9286498,284027607,2024-06-30,80,78,39,91,83,GOTTLIEB COMMUNITY HEALTH SERVICES,2023-06-30,7876056,31130298,257408502,610775,0
010217211,1,INLAND HOSPITAL,659526,1988632,84770490,2023-09-30,36,29,29,13,71,INLAND HOSPITAL,2023-09-30,49262,7520001,84742959,610264,0
390992883,1,MILE BLUFF MEDICAL CENTER  INC.,24734,352272,121801915,2023-09-30,43,45,24,34,62,Mile Bluff Medical Center Inc,2023-09-30,633000,13411234,117313908,-608266,0
851443782,1,CONCORD HOSPITAL - LACONIA,472376,2193674,144243614,2023-09-30,15,20,23,11,22,Concord Hospital - Laconia,2023-09-30,1078033,20632440,150570506,-605657,0
042768252,1,STURDY MEMORIAL HOSPITAL,1625250,4033338,256606085,2023-09-30,62,51,63,56,70,STURDY MEMORIAL HOSPITAL INC,2023-09-30,1021709,22982108,285733561,603541,0
851634852,1,VERDUGO HILLS HOSPITAL,1669680,2150352,233699638,2024-06-30,86,90,28,97,92,USC VERDUGO HILLS HOSPITAL,2023-06-30,1067361,19436983,191423873,602319,0
823745228,1,UNC ROCKINGHAM HOSPITAL,2156137,5818450,66368898,2024-06-30,85,88,82,65,70,UNC Rockingham Health Care Inc,2023-06-30,2752747,3050363,79762409,-596610,0
951643347,1,REDLANDS COMMUNITY HOSPITAL,4178036,4969037,215966916,2023-09-30,89,89,76,97,75,REDLANDS COMMUNITY HOSPITAL,2023-09-30,3589122,23720177,402070342,588914,0
344428205,1,THE BELLEVUE HOSPITAL,578882,1627436,58761347,2023-12-31,26,25,45,48,22,THE BELLEVUE HOSPITAL,2022-12-31,1159924,2543929,58272285,-581042,0
042133860,1,FAIRVIEW HOSPITAL,73029,1686348,82454469,2023-09-30,42,32,43,39,61,FAIRVIEW HOSPITAL,2023-09-30,651342,2155491,82451373,-578313,0
010211797,1,MOUNT DESERT ISLAND HOSPITAL,779866,3670825,85422959,2024-04-30,22,36,9,12,40,Mount Desert Island Hospital,2023-04-30,205152,5466982,88439225,574714,0
440607149,1,MERCY ST FRANCIS HOSPITAL,972319,1663397,17708655,2024-06-30,77,91,71,16,63,Mercy St Francis Hospital,2023-06-30,405097,1442864,17951330,567222,0
592951990,1,ADVENTHEALTH PALM COAST,7456875,9001206,264487195,2023-12-31,31,46,56,63,6,MEMORIAL HOSPITAL FLAGLER INC,2022-12-31,6890622,14233938,263405374,566253,0
381369611,1,MCLAREN PORT HURON,2450876,4876711,230916327,2023-09-30,29,43,37,28,20,MCLAREN PORT HURON,2023-09-30,1887710,6300706,245775721,563166,0
452696517,3,MARY BRECKINRIDGE HOSPITAL,566227,1602123,80472273,2024-06-30,71,86,48,1,92,ARH MARY BRECKINRIDGE HEALTH SERVICE,2023-06-30,1127659,1367962,88885232,-561432,0
481040759,1,NEWTON MEDICAL CENTER,1490051,2600133,104952435,2024-06-30,42,27,62,51,48,NEWTON HEALTHCARE CORPORATION,2023-06-30,935891,5070284,101052051,554160,0
362167884,1,ST. MARGARETS HEALTH - SPRING VALLEY,0,0,77512542,2023-08-10,35,41,56,41,20,St Margaret's Health-Spring Valley,2023-09-30,544000,18800349,77297391,-544000,0
390884478,1,BELLIN MEMORIAL HOSPITAL,3493956,5644804,594417528,2023-09-30,30,15,41,54,54,BELLIN MEMORIAL HOSPITAL INC,2023-09-30,4035734,62497307,718722309,-541778,0
020222156,1,MEMORIAL HOSPITAL,1200292,3637645,105792188,2023-09-30,14,38,13,6,11,The Memorial Hospital at North Conway,2023-09-30,664038,7246544,105333975,536254,0
440655986,1,JOHN FITZGIBBON MEMORIAL HOSPITAL,592404,2822793,68915247,2024-04-30,44,37,43,56,49,JOHN FITZGIBBON MEMORIAL HOSPITAL,2023-04-30,57756,4914049,67392993,534648,0
314413259,1,SELBY GENERAL HOSPITAL,1257655,2546416,67557451,2023-09-30,33,45,26,9,44,SELBY GENERAL HOSPITAL,2023-09-30,1787685,4912708,71837907,-530030,0
611272692,1,ST FRANCIS HOSPITAL,561870,1086948,40291429,2023-09-30,53,47,48,38,69,Charleston Hospital Inc,2023-09-30,32718,2028094,41647787,529152,0
810233499,1,SIDNEY HEALTH CENTER,1076377,2846494,106480844,2024-06-30,26,26,14,36,51,SIDNEY HEALTH CENTER,2023-06-30,547778,14098193,102102704,528599,0
350992717,1,ASCENSION ST. VINCENT KOKOMO,1969857,3191064,156171267,2024-06-30,45,42,72,46,28,St Joseph Hospital & Health Center Inc,2023-06-30,1452030,15348415,159290910,517827,0
381362830,1,MUNSON MEDICAL CENTER,2453752,6109978,812471654,2024-06-30,20,17,9,22,62,MUNSON MEDICAL CENTER,2023-06-30,1937004,62801253,766593955,516748,0
030185556,1,NORTH COUNTRY HOSPITAL & HEALTH CTR,976417,1581000,108024468,2023-09-30,35,45,30,10,47,NORTH COUNTRY HOSPITAL & HEALTH CENTER INC,2023-09-30,462278,30613929,108080771,514139,0
042104338,1,ANNA JAQUES HOSPITAL,490339,2793200,161741245,2023-09-30,61,39,56,70,80,ANNA JAQUES HOSPITAL INC,2023-09-30,1004100,17261886,163230546,-513761,0
231534300,1,HOLY REDEEMER HOSPITAL,1804535,3425771,262053661,2024-06-30,21,10,22,62,45,HOLY REDEEMER HEALTH SYSTEM,2023-06-30,1293623,15071825,383817778,510912,0
